date,stocks,count
2020-12-31,"ABCAPITAL, ADANIENT, ADANIPORTS, ADANIPOWER, APOLLO, APOLLOHOSP, APOLLOTYRE, ASHOKLEY, ASIANPAINT, AUROPHARMA, AXISBANK, BAJAJFINSV, BAJFINANCE, BANDHANBNK, BEL, BEML, BERGEPAINT, BHARTIARTL, BHEL, BIOCON, BPCL, BSE, BSOFT, CANBK, CESC, CGPOWER, CHAMBLFERT, CHOLAFIN, CIPLA, COFORGE, CROMPTON, CUMMINSIND, DABUR, DELTACORP, DHANBANK, DLF, DRREDDY, EICHERMOT, EXIDEIND, GAIL, GMRINFRA, GNFC, GODREJCP, GODREJPROP, GRAPHITE, GRASIM, GSFC, HAVELLS, HCLTECH, HDFCBANK, HDFCLIFE, HFCL, HINDALCO, HINDUNILVR, HUDCO, ICICIBANK, ICICIPRULI, IDFCFIRSTB, INDHOTEL, INDIANB, INDIGO, INDUSINDBK, INDUSTOWER, INFY, IOB, IRCON, IRCTC, ITC, JINDALSTEL, JSWENERGY, JSWSTEEL, JUBLFOOD, JUSTDIAL, KARURVYSYA, KOTAKBANK, LAURUSLABS, LICHSGFIN, LT, LTFOODS, LUPIN, M&M, MANINFRA, MARICO, MARUTI, MFSL, MINDACORP, MOTHERSON, MUTHOOTFIN, NATIONALUM, NBCC, NESTLEIND, NETWORK18, NFL, NHPC, NMDC, NTPC, ONGC, PETRONET, PFC, PIDILITIND, POWERGRID, PRAJIND, PTC, PVRINOX, RAIN, RBLBANK, RCF, RCOM, RECLTD, RPOWER, RVNL, SAIL, SBILIFE, SBIN, SHRIRAMFIN, SJVN, SONATSOFTW, SOUTHBANK, SPARC, SUNPHARMA, TATACHEM, TATAMOTORS, TATAPOWER, TATASTEEL, TCS, TECHM, TEXRAIL, TITAGARH, TITAN, TORNTPOWER, TVSMOTOR, UNIONBANK, UPL, VBL, VEDL, VOLTAS, WELCORP, WIPRO, ZEEL, ZYDUSLIFE",140
2021-01-29,"ADANIENT, ADANIPORTS, ADANIPOWER, ANANTRAJ, APOLLOHOSP, APOLLOTYRE, ASHOKLEY, AXISBANK, BANKBARODA, BEL, BHARTIARTL, BHEL, BSOFT, CANBK, CASTROLIND, CHOLAFIN, CIPLA, CONCOR, CROMPTON, CUMMINSIND, DLF, EICHERMOT, EXIDEIND, FEDERALBNK, GAIL, GATEWAY, GODREJCP, GRAPHITE, GRASIM, GSFC, HAL, HAVELLS, HDFCLIFE, HEROMOTOCO, HFCL, HINDZINC, HUDCO, ICICIBANK, IDFCFIRSTB, INDIANB, INFY, IOC, IRCTC, JSWENERGY, LAURUSLABS, LICHSGFIN, LT, LUPIN, M&M, MANINFRA, MARICO, MFSL, NATIONALUM, NBCC, NFL, NHPC, PRAJIND, PTC, PVRINOX, RCF, RVNL, SBICARD, SBIN, SHRIRAMFIN, SUNPHARMA, TATACHEM, TATAELXSI, TATAMOTORS, TATAPOWER, TCS, TECHM, TEXRAIL, TVSMOTOR, UNIONBANK, UPL, VBL, VEDL, VGUARD, VOLTAS, WIPRO, ZEEL",81
2021-02-26,"ABCAPITAL, ABFRL, ACC, ADANIENSOL, ADANIENT, ADANIGREEN, ADANIPORTS, ADANIPOWER, ADANITRANS, AMBUJACEM, APOLLOHOSP, APOLLOTYRE, ASHOKLEY, AUBANK, AXISBANK, BAJAJFINSV, BAJFINANCE, BANKBARODA, BDL, BEL, BHEL, BPCL, CANBK, CASTROLIND, CENTRALBK, CGPOWER, CHAMBLFERT, CHOLAFIN, COALINDIA, COCHINSHIP, CONCOR, CUMMINSIND, DCBBANK, DEEPAKNTR, DHANBANK, DLF, EXIDEIND, FEDERALBNK, GAIL, GNFC, GODREJPROP, GRAPHITE, GRASIM, GREENPLY, GSFC, HAL, HAVELLS, HDFCBANK, HDFCLIFE, HFCL, HINDALCO, HINDZINC, HUDCO, ICICIBANK, IDFCFIRSTB, IIFL, INDIANB, INDUSINDBK, INDUSTOWER, IOB, IOC, IRCON, IRCTC, JINDALSTEL, JSWENERGY, JSWSTEEL, JUBLFOOD, JUSTDIAL, KARURVYSYA, LICHSGFIN, LT, M&M, MANAPPURAM, MFSL, MINDACORP, MOTHERSON, MUTHOOTFIN, NATIONALUM, NBCC, NETWORK18, NFL, NHPC, NIACL, NMDC, NTPC, ONGC, PETRONET, PFC, PNB, PNBHOUSING, POWERGRID, PRAJIND, PSB, PTC, RAIN, RAYMOND, RCF, RELIANCE, RPOWER, RVNL, SAIL, SBICARD, SBIN, SHRIRAMFIN, SIEMENS, SONATSOFTW, SOUTHBANK, TATACHEM, TATAMOTORS, TATAPOWER, TATASTEEL, TORNTPOWER, TVSMOTOR, UNIONBANK, UPL, VBL, VEDL, VGUARD, VOLTAS",119
2021-03-31,"ABCAPITAL, ABFRL, ACC, ADANIENSOL, ADANIENT, ADANIPORTS, ADANIPOWER, ADANITRANS, AMBUJACEM, ASIANPAINT, AUBANK, BEML, BERGEPAINT, BHEL, BPCL, BSOFT, CANFINHOME, CGPOWER, CHOLAFIN, CIPLA, COFORGE, CONCOR, CUMMINSIND, DABUR, DEEPAKNTR, DELTACORP, DHANBANK, GNFC, GODREJCP, GRAPHITE, GRASIM, HCLTECH, HINDALCO, HINDUNILVR, IDBI, INFY, INTELLECT, IOB, IRCTC, ITC, JINDALSTEL, JSWENERGY, JSWSTEEL, JUBLFOOD, JUSTDIAL, KARURVYSYA, LAURUSLABS, LTFOODS, MANINFRA, MARICO, MFSL, MOTHERSON, NATIONALUM, NBCC, NESTLEIND, NFL, NHPC, NIACL, NMDC, NTPC, PIDILITIND, POWERGRID, PRAJIND, PTC, RAYMOND, RCF, RPOWER, SAIL, SAREGAMA, SHRIRAMFIN, SONATSOFTW, TATACHEM, TATAPOWER, TATASTEEL, TCS, TECHM, TITAN, TORNTPOWER, UPL, VBL, VEDL, WELCORP",82
2021-04-30,"ACC, ADANIENSOL, ADANIENT, ADANIPORTS, ADANIPOWER, ADANITRANS, AMBUJACEM, APOLLOHOSP, ASIANPAINT, AUROPHARMA, BAJAJFINSV, BAJFINANCE, BHEL, BSE, CGPOWER, CHOLAFIN, CIPLA, COFORGE, CONCOR, DABUR, DEEPAKNTR, DRREDDY, FEDERALBNK, GATEWAY, GLENMARK, GNFC, GRAPHITE, GRASIM, GSFC, GUJALKALI, HFCL, HIKAL, HINDALCO, HINDUNILVR, HINDZINC, ICICIBANK, ICICIPRULI, INFY, IRCTC, JINDALSTEL, JSWENERGY, JSWSTEEL, JUSTDIAL, LAURUSLABS, LTFOODS, LUPIN, MARICO, MOTHERSON, NATIONALUM, NFL, NMDC, ONGC, PIDILITIND, POWERGRID, PRAJIND, PSB, PTC, RAIN, RPOWER, SAIL, SBILIFE, SRF, SUNPHARMA, TATACHEM, TATASTEEL, TITAN, TVSMOTOR, UPL, VEDL, WELCORP, WIPRO, ZYDUSLIFE",72
2021-05-31,"ABCAPITAL, ABFRL, ADANIENSOL, ADANIENT, ADANIPORTS, ADANITRANS, AMBUJACEM, APOLLOTYRE, ASHOKLEY, ASIANPAINT, AUROPHARMA, AXISBANK, BAJAJFINSV, BAJFINANCE, BANKBARODA, BEL, BERGEPAINT, BHEL, BPCL, BSE, BSOFT, CANBK, CASTROLIND, CENTRALBK, CESC, CGPOWER, CHAMBLFERT, CIPLA, COALINDIA, COFORGE, CONCOR, CROMPTON, CSBBANK, DCBBANK, DEEPAKNTR, DELTACORP, DHANBANK, DLF, DRREDDY, EIDPARRY, EXIDEIND, FEDERALBNK, FINCABLES, GAIL, GATEWAY, GLENMARK, GMRINFRA, GNFC, GODREJCP, GRAPHITE, GRASIM, GSFC, HAVELLS, HDFCBANK, HFCL, HIKAL, HINDALCO, HINDZINC, HUDCO, ICICIBANK, ICICIPRULI, IDFCFIRSTB, INDHOTEL, INDIANB, INDUSINDBK, INFY, IOB, IOC, IRCTC, ITC, JINDALSTEL, JSWENERGY, JSWSTEEL, JUBLFOOD, JUSTDIAL, KARURVYSYA, KOTAKBANK, LAURUSLABS, LICHSGFIN, LT, LTFOODS, LUPIN, M&M, MANAPPURAM, MANINFRA, MARICO, MINDACORP, MOTHERSON, MUTHOOTFIN, NATCOPHARM, NATIONALUM, NBCC, NESTLEIND, NFL, NHPC, NIACL, NMDC, NTPC, ONGC, PFC, PIDILITIND, PNB, POWERGRID, PRAJIND, PSB, PTC, PVRINOX, RAIN, RAYMOND, RBLBANK, RCF, RECLTD, RELIANCE, RPOWER, RVNL, SAIL, SBICARD, SBILIFE, SBIN, SHRIRAMFIN, SIEMENS, SJVN, SOUTHBANK, SPARC, SRF, SUNPHARMA, TATAMOTORS, TATAPOWER, TATASTEEL, TCS, TECHM, TEXRAIL, TITAN, TORNTPOWER, TVSMOTOR, UPL, VBL, VEDL, VGUARD, VOLTAS, WELCORP, WIPRO, ZEEL, ZYDUSLIFE",144
2021-06-30,"ABFRL, ADANIENT, ADANIPOWER, AMBUJACEM, APOLLO, APOLLOTYRE, ASHOKLEY, ASIANPAINT, AUBANK, AXISBANK, BAJAJFINSV, BAJFINANCE, BANKBARODA, BEL, BHEL, BPCL, BSE, BSOFT, CANBK, CASTROLIND, CENTRALBK, CESC, CHAMBLFERT, CIPLA, COALINDIA, COCHINSHIP, COFORGE, CONCOR, CROMPTON, CUMMINSIND, DABUR, DCBBANK, DEEPAKNTR, DELTACORP, DHANBANK, DLF, DRREDDY, EIDPARRY, FEDERALBNK, GATEWAY, GLENMARK, GLOBUSSPR, GMRINFRA, GODREJCP, GRASIM, GSFC, HCLTECH, HDFCBANK, HDFCLIFE, HFCL, HINDUNILVR, HINDZINC, HUDCO, ICICIBANK, ICICIPRULI, INDBANK, INDHOTEL, INDIANB, INDUSINDBK, INFY, IOB, IOC, IRCON, IRCTC, JSWENERGY, JUBLFOOD, JUSTDIAL, LAURUSLABS, LICHSGFIN, LT, MANAPPURAM, MANINFRA, MARICO, MAXHEALTH, MFSL, MIDHANI, MOTHERSON, MUTHOOTFIN, NATIONALUM, NBCC, NESTLEIND, NETWORK18, NEWGEN, NFL, NHPC, NIACL, NMDC, NTPC, ONGC, PFC, PNB, POWERGRID, PRAJIND, PSB, PTC, RADICO, RAIN, RAYMOND, RCF, RCOM, RECLTD, RPOWER, RVNL, SAIL, SBILIFE, SBIN, SJVN, SOUTHBANK, SPARC, SUNPHARMA, SUPRAJIT, TATACHEM, TATAMOTORS, TATAPOWER, TATASTEEL, TCS, TECHM, TEXRAIL, THYROCARE, TITAGARH, TITAN, TORNTPOWER, TVSMOTOR, UNIONBANK, UPL, VBL, VGUARD, VOLTAS, WIPRO, ZYDUSLIFE",130
2021-07-30,"ABFRL, ACC, AMBUJACEM, APOLLO, ASHOKLEY, AUBANK, BAJAJFINSV, BAJFINANCE, BALAJITELE, BDL, BEL, BERGEPAINT, BHARTIARTL, BSE, BSOFT, CANBK, CENTRALBK, CESC, CHAMBLFERT, COFORGE, CROMPTON, DABUR, DEEPAKNTR, DELTACORP, DHANBANK, DLF, FEDERALBNK, GABRIEL, GODREJCP, GRASIM, GSFC, GUJALKALI, HAL, HAPPSTMNDS, HAVELLS, HCLTECH, HFCL, HINDALCO, ICICIBANK, ICICIPRULI, INDHOTEL, INFY, IOB, IRCTC, JINDALSTEL, JSWENERGY, JSWSTEEL, JUBLFOOD, LAURUSLABS, LT, MANAPPURAM, MANINFRA, MARICO, MAXHEALTH, MPHASIS, MUTHOOTFIN, NATIONALUM, NESTLEIND, NETWORK18, NHPC, NMDC, NTPC, ORIENTELEC, PFC, PRESTIGE, RAIN, RAYMOND, RCF, RECLTD, ROUTE, SAIL, SBICARD, SBILIFE, SBIN, SOBHA, SPARC, SRF, SUNPHARMA, TATACHEM, TATAPOWER, TATASTEEL, TECHM, TEXRAIL, TITAGARH, TITAN, VBL, VEDL, WIPRO",88
2021-08-31,"ADANIENT, ADANIPORTS, AMBUJACEM, APOLLOHOSP, ASIANPAINT, AXISBANK, BAJAJFINSV, BAJFINANCE, BEL, BHARTIARTL, BPCL, BSE, BSOFT, CANBK, CESC, CGPOWER, CHAMBLFERT, CHOLAFIN, CIPLA, COALINDIA, COFORGE, CONCOR, CROMPTON, CUMMINSIND, DABUR, DEEPAKNTR, DELTACORP, DLF, EICHERMOT, GABRIEL, GODREJCP, HAL, HAVELLS, HCLTECH, HDFCBANK, HDFCLIFE, HIKAL, HINDALCO, HINDUNILVR, ICICIBANK, ICICIPRULI, IDBI, INFY, IOC, IRCTC, ITC, JSWENERGY, JUBLFOOD, LAURUSLABS, LT, M&M, MANINFRA, MARICO, MAXHEALTH, NATIONALUM, NESTLEIND, NHPC, NIACL, ONGC, PFC, PIDILITIND, POWERGRID, PRESTIGE, RAIN, RECLTD, RELIANCE, SBICARD, SBILIFE, SIEMENS, SONATSOFTW, SPARC, SRF, SUNPHARMA, TATACHEM, TATAPOWER, TATASTEEL, TCS, TECHM, TITAGARH, TITAN, TORNTPOWER, TRENT, VBL, VEDL, WIPRO",85
2021-09-30,"ABFRL, ADANIENSOL, ADANIGREEN, ADANIPORTS, ADANIPOWER, ADANITRANS, APOLLOTYRE, ASHOKLEY, BAJAJFINSV, BAJFINANCE, BANKBARODA, BEL, BHARTIARTL, BHEL, BRIGADE, BSE, CANBK, CANFINHOME, CENTRALBK, CESC, CGPOWER, CHAMBLFERT, CHOLAFIN, CIPLA, COALINDIA, COFORGE, CONCOR, CROMPTON, DABUR, DELTACORP, DLF, FEDERALBNK, GAIL, GMRINFRA, GNFC, GODREJPROP, GRASIM, GSFC, GUJALKALI, HAL, HAVELLS, HCLTECH, HDFCBANK, HDFCLIFE, HFCL, HINDALCO, HINDUNILVR, ICICIPRULI, IDBI, INDHOTEL, INDIANB, INDIGO, INDUSINDBK, INDUSTOWER, IOB, IOC, IRCTC, ITC, JSWENERGY, JUBLFOOD, KEI, KOTAKBANK, LT, LTFOODS, M&M, MANINFRA, MARICO, MAXHEALTH, MAZDOCK, MOTHERSON, NATIONALUM, NBCC, NESTLEIND, NETWORK18, NFL, NHPC, NTPC, OBEROIRLTY, ONGC, PFC, PHOENIXLTD, PNB, POWERGRID, PRESTIGE, PTC, PVRINOX, RAIN, RAYMOND, RCF, RCOM, RECLTD, RELIANCE, RPOWER, RVNL, SBILIFE, SBIN, SJVN, SONATSOFTW, SRF, SUNPHARMA, TATACHEM, TATAMOTORS, TATAPOWER, TCS, TECHM, TORNTPOWER, UNIONBANK, VBL, VGUARD, VOLTAS, WELCORP, WIPRO, ZEEL",113
2021-10-29,"ABFRL, ADANIPOWER, ASHOKLEY, AUBANK, BAJAJFINSV, BANKBARODA, BDL, BEL, BHARTIARTL, BHEL, BSE, CANBK, CENTRALBK, CESC, CGPOWER, CHAMBLFERT, CHOLAFIN, DELTACORP, DLF, DMART, FEDERALBNK, GATEWAY, GMRINFRA, GNFC, GODREJPROP, GRASIM, GSFC, ICICIBANK, IDBI, INDHOTEL, INDIANB, INDUSINDBK, INDUSTOWER, IOB, IOC, IRCON, IRCTC, JINDALSTEL, JSWENERGY, KKCL, KOTAKBANK, LT, LTFOODS, M&M, MAHSEAMLES, MANAPPURAM, MANINFRA, MARICO, MAZDOCK, MINDACORP, MPHASIS, NATIONALUM, NETWORK18, NHPC, NTPC, OBEROIRLTY, ONGC, PNB, POWERGRID, PTC, PVRINOX, RAYMOND, RELIANCE, RPOWER, RVNL, SBIN, SHRIRAMFIN, SJVN, TATAMOTORS, TATAPOWER, TECHM, TEXRAIL, TITAN, TORNTPOWER, TVSMOTOR, UNIONBANK, UPL, VOLTAS, ZEEL",79
2021-11-30,"ADANIENT, ADANIGREEN, APOLLOHOSP, BHARTIARTL, BSE, BSOFT, CANBK, CGPOWER, CHAMBLFERT, CIPLA, COFORGE, HINDZINC, MANINFRA, MAXHEALTH, MINDACORP, NHPC, POWERGRID, RAYMOND, SOBHA, TATAMOTORS, TATAPOWER, TECHM, TITAN, TORNTPOWER, TVSMOTOR, VEDL, WELCORP, ZEEL",28
2021-12-31,"ADANIENT, APOLLO, ASIANPAINT, BEL, BSE, BSOFT, CGPOWER, CHAMBLFERT, CIPLA, COFORGE, GMRINFRA, GODREJCP, HCLTECH, HFCL, HINDALCO, INFY, LT, LTFOODS, MAXHEALTH, NATIONALUM, NETWORK18, PIDILITIND, POWERGRID, RAIN, RAYMOND, RCOM, SBILIFE, SIEMENS, SJVN, SUNPHARMA, TCS, TECHM, TEXRAIL, TITAN, UPL, VEDL, WELCORP, WIPRO",38
2022-01-31,"ABFRL, ADANIPOWER, APOLLO, ASHOKLEY, AUBANK, AXISBANK, BANKBARODA, BDL, BEL, BHARTIARTL, BSE, CANBK, CENTRALBK, CHAMBLFERT, CHOLAFIN, CIPLA, COALINDIA, DELTACORP, EASEMYTRIP, FEDERALBNK, GMRINFRA, GNFC, GRASIM, GSFC, HAL, HINDALCO, ICICIBANK, INDHOTEL, INDIANB, IOB, IOC, IRCTC, JUSTDIAL, LT, M&M, MANINFRA, MINDACORP, MOTHERSON, NATIONALUM, NTPC, OBEROIRLTY, ONGC, PIDILITIND, PNB, POWERGRID, PRAJIND, PRESTIGE, PVRINOX, RAYMOND, RCF, RCOM, RPOWER, RVNL, SBILIFE, SBIN, SHARDACROP, SJVN, SPARC, SUNPHARMA, TATACHEM, TATAMOTORS, TATAPOWER, TCS, TEXRAIL, TITAGARH, UNIONBANK, UPL, VBL, WELCORP",69
2022-02-28,"ADANIPOWER, BALAJITELE, BANDHANBNK, BANKBARODA, BDL, BEL, CHOLAFIN, COALINDIA, EASEMYTRIP, FEDERALBNK, GNFC, GSFC, HAL, HINDALCO, INDHOTEL, NATIONALUM, NTPC, OBEROIRLTY, ONGC, POWERGRID, RAYMOND, SUNPHARMA, TITAN, VBL, VEDL, VOLTAS",26
2022-03-31,"ABFRL, ADANIENT, ADANIPOWER, AUBANK, AXISBANK, BAJAJFINSV, BAJFINANCE, BANKBARODA, BDL, BEL, BHARTIARTL, BSE, BSOFT, CGPOWER, CHAMBLFERT, CHOLAFIN, CIPLA, COALINDIA, DELTACORP, DLF, EASEMYTRIP, GNFC, GRASIM, GSFC, GUJALKALI, HAL, HCLTECH, HFCL, HINDALCO, INDHOTEL, INDIANB, INDIGO, INFY, ITC, JINDALSTEL, LTFOODS, MINDACORP, NATIONALUM, NETWORK18, NTPC, PIDILITIND, POWERGRID, PRAJIND, PVRINOX, RAYMOND, RCF, RELIANCE, SUNPHARMA, TATACHEM, TATAPOWER, TATASTEEL, TCS, TECHM, TEXRAIL, TITAN, VBL, VEDL, VOLTAS, WELCORP, ZEEL",60
2022-04-29,"ABCAPITAL, ABFRL, ADANIENT, ADANIGREEN, ADANIPORTS, ADANIPOWER, APOLLO, ASIANPAINT, AUBANK, BANDHANBNK, BANKBARODA, BDL, BEL, BHARTIARTL, BSE, CANBK, CESC, CGPOWER, CHAMBLFERT, CHOLAFIN, COALINDIA, EASEMYTRIP, GAIL, GATEWAY, GNFC, GRASIM, GRSE, GSFC, GUJALKALI, HAL, ICICIBANK, IIFL, INDHOTEL, INDIANB, IOC, ITC, JINDALSTEL, JSWSTEEL, LTFOODS, M&M, MAXHEALTH, MAZDOCK, MINDACORP, NHPC, NTPC, POWERGRID, PRAJIND, RAYMOND, RCF, RELIANCE, RPOWER, RVNL, SBIN, SUNPHARMA, SWANENERGY, TATAPOWER, TEXRAIL, TITAGARH, TVSMOTOR, UPL, VBL, VEDL, VOLTAS, WELCORP, YESBANK",65
2022-05-31,"ADANIENT, ADANIPOWER, ASHOKLEY, BANDHANBNK, BDL, BEL, CIPLA, COALINDIA, GMRINFRA, GSFC, HAL, ICICIBANK, INDIANB, ITC, M&M, MARICO, NHPC, NTPC, PETRONET, POWERGRID, RAYMOND, RCF, RELIANCE, SBILIFE, TATAELXSI, TATAMOTORS, TEXRAIL, TVSMOTOR, VBL, WELCORP",30
2022-06-30,"ADANIENT, ASHOKLEY, CGPOWER, EASEMYTRIP, HAL, ITC, M&M, TVSMOTOR, VBL, WELCORP",10
2022-07-29,"ADANIENT, ADANIGREEN, ADANIPORTS, ADANIPOWER, AEGISLOG, APOLLO, ASHOKLEY, ASIANPAINT, BANKBARODA, BDL, BEL, CANBK, CGPOWER, CHOLAFIN, CIPLA, COALINDIA, CONCOR, DEVYANI, EASEMYTRIP, FEDERALBNK, GNFC, GSFC, HAL, ICICIBANK, INDHOTEL, INDIANB, ITC, KARURVYSYA, LT, LTFOODS, M&M, NESTLEIND, NHPC, NTPC, RAYMOND, RCF, SBILIFE, SBIN, SHRIRAMFIN, SUNPHARMA, TITAGARH, TVSMOTOR, VBL, WELCORP, YESBANK",45
2022-08-30,"ABCAPITAL, ABFRL, ADANIENT, ADANIGREEN, ADANIPORTS, ADANIPOWER, AEGISLOG, ANANTRAJ, APOLLO, APOLLOTYRE, ASHOKLEY, ASIANPAINT, AUBANK, BANKBARODA, BDL, BEL, CANBK, CGPOWER, CHOLAFIN, CIPLA, COALINDIA, DEVYANI, EICHERMOT, FEDERALBNK, GNFC, GSFC, HAL, HINDUNILVR, ICICIBANK, INDHOTEL, INDIANB, INDUSINDBK, ITC, JINDALSTEL, JSWENERGY, KARURVYSYA, LAURUSLABS, LTFOODS, M&M, MAXHEALTH, MAZDOCK, NAVNETEDUL, NESTLEIND, NHPC, NTPC, POWERGRID, RCF, RELIANCE, RPOWER, SBILIFE, SBIN, SIEMENS, SJVN, SUNPHARMA, TATACHEM, TEXRAIL, TITAGARH, TITAN, TRENT, TVSMOTOR, VBL, WELCORP, YESBANK",63
2022-09-30,"ABFRL, ACC, ADANIENT, ADANIPOWER, AMBUJACEM, ANANTRAJ, APOLLO, APOLLOTYRE, BAJFINANCE, BANKBARODA, BDL, BEL, BHARTIARTL, CGPOWER, CIPLA, COCHINSHIP, CONCOR, DCBBANK, DEVYANI, FEDERALBNK, GRSE, HAL, HINDUNILVR, ICICIBANK, IIFL, INDHOTEL, INDIANB, INDUSINDBK, ITC, JINDALSTEL, KARURVYSYA, LICHSGFIN, LTFOODS, M&M, MARICO, MAXHEALTH, MAZDOCK, MIDHANI, RAYMOND, RPOWER, SJVN, SOUTHBANK, SUNPHARMA, TATACHEM, TEXRAIL, TITAN, TVSMOTOR, UJJIVANSFB, VBL, WELCORP",50
2022-10-31,"ABFRL, AEGISLOG, AMBUJACEM, ANANTRAJ, APOLLO, APOLLOTYRE, AXISBANK, BANKBARODA, BDL, BEL, BHARTIARTL, BHEL, CANBK, CASTROLIND, CGPOWER, CIPLA, COALINDIA, COCHINSHIP, CONCOR, DCBBANK, DEVYANI, FEDERALBNK, GNFC, GRSE, HAL, ICICIBANK, IDFCFIRSTB, INDHOTEL, INDIANB, ITC, JINDALSTEL, JSWENERGY, KARURVYSYA, LT, LTFOODS, M&M, MARICO, MAXHEALTH, MAZDOCK, MIDHANI, NESTLEIND, NHPC, NTPC, PNB, POWERGRID, RAYMOND, RCF, RELIANCE, RVNL, SBIN, SJVN, SOUTHBANK, SUNPHARMA, TATACHEM, TEXRAIL, TITAN, TVSMOTOR, UJJIVANSFB, UNIONBANK",59
2022-11-30,"ABCAPITAL, ADANIENT, ADANIPORTS, AMBUJACEM, APOLLO, APOLLOTYRE, AXISBANK, BANKBARODA, BDL, BHARTIARTL, BHEL, CANBK, CASTROLIND, CENTRALBK, CGPOWER, CIPLA, COCHINSHIP, CONCOR, DABUR, DCBBANK, DHANBANK, DLF, DRREDDY, EASEMYTRIP, EXIDEIND, FEDERALBNK, GABRIEL, GMRINFRA, GRSE, HAL, HDFCBANK, HINDUNILVR, HUDCO, ICICIBANK, IDBI, IDFCFIRSTB, INDIANB, IOB, IRCON, IRFC, JINDALSTEL, JSWSTEEL, KARURVYSYA, KOTAKBANK, LT, M&M, MAXHEALTH, MAZDOCK, MIDHANI, NESTLEIND, NFL, NHPC, NTPC, PFC, PNB, POWERGRID, PSB, RAILTEL, RAYMOND, RBLBANK, RCF, RECLTD, RELIANCE, RVNL, SBIN, SHRIRAMFIN, SJVN, SOUTHBANK, SUNPHARMA, TEXRAIL, TIINDIA, TITAN, UJJIVANSFB, UNIONBANK, UPL, VBL, WELCORP, YESBANK, ZYDUSLIFE",79
2022-12-30,"ABCAPITAL, ADANIENT, AEGISLOG, ANANTRAJ, APOLLO, APOLLOTYRE, AUBANK, AXISBANK, BANKBARODA, BHEL, CANBK, CENTRALBK, CGPOWER, DCBBANK, DHANBANK, FEDERALBNK, GMRINFRA, HDFCBANK, HDFCLIFE, HIKAL, HUDCO, IDBI, IDFCFIRSTB, INDBANK, INDIANB, INDUSINDBK, IOB, IRCON, IRFC, JINDALSTEL, JSWSTEEL, KARURVYSYA, LICHSGFIN, LT, MAXHEALTH, NFL, NIACL, NMDC, PETRONET, PFC, PNB, PNBHOUSING, PSB, RAYMOND, RBLBANK, RCF, RECLTD, RVNL, SBIN, SHRIRAMFIN, SOUTHBANK, SURYODAY, TEXRAIL, TVSMOTOR, UJJIVANSFB, UNIONBANK, VBL, YESBANK",58
2023-01-31,"ANANTRAJ, APOLLO, APOLLOTYRE, ASHOKLEY, CGPOWER, COALINDIA, COFORGE, GODREJCP, INDIANB, IRFC, ITC, JINDALSTEL, KARURVYSYA, LICHSGFIN, M&M, MAXHEALTH, MFSL, NFL, NHPC, NTPC, PERSISTENT, PETRONET, PNBHOUSING, PTC, RAYMOND, RECLTD, RVNL, SUNPHARMA, SWANENERGY, TATAMOTORS, TVSMOTOR, ZYDUSLIFE",32
2023-02-28,"ABCAPITAL, BDL, CGPOWER, CHOLAFIN, COFORGE, GAIL, GLENMARK, HAL, ITC, MOTHERSON, NTPC, PETRONET, SONATSOFTW, TORNTPOWER, TVSMOTOR, VBL, ZYDUSLIFE",17
2023-03-31,"ABCAPITAL, ANANTRAJ, APOLLOTYRE, BANKBARODA, BDL, BEL, BPCL, CHOLAFIN, COCHINSHIP, DRREDDY, FEDERALBNK, FINCABLES, GAIL, GLENMARK, GMRINFRA, GODREJCP, HAL, HINDUNILVR, ICICIBANK, INDHOTEL, INDIANB, IRCON, ITC, KARURVYSYA, MANAPPURAM, NBCC, NESTLEIND, NFL, NTPC, PAYTM, PETRONET, PFC, POLICYBZR, POWERGRID, RVNL, SJVN, SONATSOFTW, TECHM, TITAGARH, VBL",40
2023-04-28,"ABCAPITAL, ANANTRAJ, APOLLOTYRE, AUBANK, AUROPHARMA, AXISBANK, BANKBARODA, BDL, BEL, BHARTIARTL, BHEL, BPCL, CANBK, CENTRALBK, CGPOWER, CHOLAFIN, COALINDIA, COCHINSHIP, COFORGE, DELTACORP, DHANBANK, DLF, DRREDDY, ETERNAL, EXIDEIND, FEDERALBNK, GAIL, GLENMARK, GMRINFRA, GSFC, HAL, HDFCBANK, HINDALCO, HINDZINC, HUDCO, ICICIBANK, IDBI, IDFCFIRSTB, INDHOTEL, INDIANB, INDUSINDBK, IOB, IOC, IRCON, IRFC, ITC, JINDALSTEL, JSWSTEEL, KOTAKBANK, LT, LTFOODS, LUPIN, MANAPPURAM, MAXHEALTH, MAZDOCK, MINDACORP, NATIONALUM, NBCC, NESTLEIND, NFL, NHPC, ONGC, PETRONET, PFC, PNB, POLICYBZR, POWERGRID, PSB, PTC, RAILTEL, RAYMOND, RBLBANK, RCF, RECLTD, RVNL, SBIN, SHRIRAMFIN, SJVN, SONATSOFTW, SUNPHARMA, TATAMOTORS, TATASTEEL, TEXRAIL, TITAGARH, TVSMOTOR, UJJIVANSFB, UNIONBANK, UPL, VBL",89
2023-05-31,"ABCAPITAL, ANANTRAJ, APOLLO, APOLLOTYRE, AUBANK, AUROPHARMA, AXISBANK, BANKBARODA, BDL, BEL, BHARTIARTL, BHEL, BPCL, CANBK, CENTRALBK, CGPOWER, CHOLAFIN, COALINDIA, COFORGE, DCBBANK, DELTACORP, DHANBANK, DLF, ETERNAL, EXIDEIND, GLENMARK, GODREJCP, HAL, HCLTECH, HDFCLIFE, HINDUNILVR, HUDCO, ICICIBANK, IDBI, IDFCFIRSTB, INDHOTEL, INDUSINDBK, IOB, IOC, IRCON, IRFC, ITC, KARURVYSYA, KEC, KOTAKBANK, LODHA, LTFOODS, LUPIN, M&M, MANINFRA, MARICO, MAXHEALTH, MAZDOCK, NATIONALUM, NBCC, NESTLEIND, NHPC, NIACL, PFC, PNB, POLICYBZR, POWERGRID, PSB, PTC, RAILTEL, RBLBANK, RECLTD, RVNL, SBIN, SHRIRAMFIN, SIEMENS, SJVN, SONATSOFTW, SOUTHBANK, SUNPHARMA, SURYODAY, TATAMOTORS, TECHM, TEXRAIL, TVSMOTOR, UJJIVANSFB, UNIONBANK, VBL",83
2023-06-30,"ABCAPITAL, ANANTRAJ, APOLLO, APOLLOTYRE, ASHOKLEY, AUBANK, AUROPHARMA, AXISBANK, BANKBARODA, BDL, BEL, BHARTIARTL, BHEL, BPCL, BSOFT, CASTROLIND, CENTRALBK, CGPOWER, CHOLAFIN, COCHINSHIP, COFORGE, DELTACORP, DHANBANK, DLF, DRREDDY, ETERNAL, EXIDEIND, GLENMARK, GRSE, GSFC, HAL, HCLTECH, HDFCAMC, HDFCBANK, HDFCLIFE, HINDUNILVR, HUDCO, ICICIBANK, IDBI, IDFCFIRSTB, IIFL, INDHOTEL, INDIANB, INDUSINDBK, IOC, IRCON, IRFC, ITC, JINDALSTEL, JSWSTEEL, KARURVYSYA, LODHA, LT, LTFOODS, LUPIN, M&M, MANAPPURAM, MANINFRA, MARICO, MAXHEALTH, MAZDOCK, MIDHANI, MINDACORP, MOTHERSON, NAZARA, NESTLEIND, NHPC, NTPC, PAYTM, PFC, PNB, POLICYBZR, POWERGRID, PTC, RAILTEL, RAYMOND, RBLBANK, RCF, RECLTD, RVNL, SAIL, SHRIRAMFIN, SJVN, SOUTHBANK, SUNPHARMA, TATACOMM, TATAMOTORS, TATASTEEL, TCS, TECHM, TEXRAIL, TITAGARH, TORNTPOWER, UJJIVANSFB, UNIONBANK, VBL, WELCORP, ZYDUSLIFE",98
2023-07-31,"ABCAPITAL, AEGISLOG, APOLLO, APOLLOTYRE, ASHOKLEY, AUROPHARMA, BANKBARODA, BDL, BEL, BHARTIARTL, BHEL, BPCL, BSE, BSOFT, CANBK, CASTROLIND, CENTRALBK, CGPOWER, CHOLAFIN, CIPLA, COCHINSHIP, COFORGE, DABUR, DCBBANK, DHANBANK, DLF, DRREDDY, ETERNAL, EXIDEIND, FEDERALBNK, GAIL, GLENMARK, GMRINFRA, GRAPHITE, GRSE, GSFC, HAL, HDFCBANK, HDFCLIFE, HINDALCO, HINDZINC, HUDCO, ICICIBANK, ICICIPRULI, IDBI, IDFCFIRSTB, INDHOTEL, INDIANB, INDUSINDBK, INTELLECT, IOB, IOC, IRCON, IRFC, ITC, JINDALSTEL, JSWSTEEL, KARURVYSYA, LODHA, LT, LTFOODS, M&M, MANAPPURAM, MANINFRA, MARICO, MAXHEALTH, MAZDOCK, MIDHANI, MINDACORP, MOTHERSON, NATIONALUM, NBCC, NESTLEIND, NEWGEN, NFL, NHPC, NMDC, NTPC, ONGC, PETRONET, PFC, PNB, POLICYBZR, POLYCAB, POWERGRID, PRESTIGE, PSB, PTC, RAILTEL, RAYMOND, RBLBANK, RCF, RECLTD, RELIANCE, RVNL, SAIL, SBILIFE, SBIN, SHRIRAMFIN, SJVN, SONACOMS, SOUTHBANK, SPARC, SUNPHARMA, TATACOMM, TATAMOTORS, TATAPOWER, TATASTEEL, TCS, TEXRAIL, TITAGARH, TITAN, TVSMOTOR, UJJIVANSFB, UNIONBANK, WELCORP",116
2023-08-31,"ANANTRAJ, ASHOKLEY, ASTRAL, AUROPHARMA, AXISBANK, BEL, BERGEPAINT, BHEL, BSE, BSOFT, CASTROLIND, CENTRALBK, CESC, CGPOWER, CHOLAFIN, CIPLA, COCHINSHIP, COFORGE, DELHIVERY, DEVYANI, DHANBANK, DLF, DRREDDY, ETERNAL, EXIDEIND, FEDERALBNK, GABRIEL, GAIL, GATEWAY, GMRINFRA, GNFC, GRAPHITE, GRSE, GSFC, HAL, HCLTECH, HDFCAMC, HINDALCO, HUDCO, IDBI, IDFCFIRSTB, INDHOTEL, INDIANB, IOB, IRCON, IRFC, JINDALSTEL, JSWENERGY, LICHSGFIN, LICI, LT, LTFOODS, LUPIN, M&M, MANAPPURAM, MANINFRA, MARICO, MAXHEALTH, MAZDOCK, MFSL, MIDHANI, MINDACORP, MOTHERSON, NATIONALUM, NAZARA, NBCC, NETWORK18, NHPC, NIACL, NMDC, NTPC, ONGC, PARADEEP, PAYTM, PFC, PNB, POLICYBZR, PRAJIND, PSB, PTC, RAILTEL, RBLBANK, RCF, RECLTD, RPOWER, RVNL, SAIL, SHRIRAMFIN, SJVN, SONACOMS, SOUTHBANK, SPARC, SUNPHARMA, SUPREMEIND, SWANENERGY, TATACOMM, TATAPOWER, TATASTEEL, TECHM, TEXRAIL, TITAGARH, TRENT, TVSMOTOR, UJJIVANSFB, UNIONBANK, VBL, VOLTAS, WELCORP, WIPRO, ZYDUSLIFE",110
2023-09-29,"ADANIPOWER, ANANTRAJ, APOLLO, AUROPHARMA, AXISBANK, BAJFINANCE, BANDHANBNK, BANKBARODA, BEL, BHARTIARTL, BHEL, BSE, BSOFT, CANBK, CENTRALBK, CESC, CGPOWER, CHOLAFIN, COALINDIA, COCHINSHIP, DEVYANI, DHANBANK, DLF, ETERNAL, FEDERALBNK, GAIL, GLENMARK, GMRINFRA, GNFC, GRAPHITE, GRSE, GSFC, HCLTECH, HINDALCO, HUDCO, ICICIPRULI, IDBI, IDFCFIRSTB, INDBANK, INDHOTEL, INDIANB, INDUSINDBK, IOB, IRCON, IRFC, JINDALSTEL, JSWENERGY, KARURVYSYA, LICHSGFIN, LODHA, LT, LUPIN, M&M, MANAPPURAM, MANINFRA, MAZDOCK, MIDHANI, NATIONALUM, NAZARA, NBCC, NESTLEIND, NFL, NHPC, NIACL, NMDC, NTPC, ONGC, PARADEEP, PAYTM, PETRONET, PFC, PNB, POWERGRID, PRAJIND, PSB, PTC, RAILTEL, RBLBANK, RECLTD, RPOWER, RVNL, SAIL, SHRIRAMFIN, SJVN, SOBHA, SONACOMS, SOUTHBANK, SUNPHARMA, SWANENERGY, TATAMOTORS, TATAPOWER, TATASTEEL, TCS, TECHM, TEXRAIL, TITAGARH, TVSMOTOR, UJJIVANSFB, UNIONBANK, VBL, VOLTAS, WELCORP, ZEEL",103
2023-10-31,"ADANIPOWER, ANANTRAJ, APOLLO, APOLLOTYRE, BAJAJFINSV, BHARTIARTL, BSE, BSOFT, CANBK, COALINDIA, DHANBANK, DLF, ETERNAL, GNFC, GSFC, HCLTECH, INDIANB, INDUSINDBK, IOB, IRCON, IRFC, KARURVYSYA, LICHSGFIN, LODHA, LT, MAXHEALTH, NBCC, NESTLEIND, NIACL, NMDC, NTPC, ONGC, PAYTM, PFC, PNB, POWERGRID, PRESTIGE, PTC, RAILTEL, RECLTD, SBILIFE, SJVN, SOBHA, SWANENERGY, TATAMOTORS, UNIONBANK, WELCORP",47
2023-11-30,"ADANIENT, ADANIGREEN, ADANIPORTS, ADANIPOWER, AEGISLOG, AMBUJACEM, ANANTRAJ, APLAPOLLO, APOLLO, APOLLOTYRE, ASHOKLEY, AUBANK, AUROPHARMA, AXISBANK, BAJAJFINSV, BDL, BEL, BHARTIARTL, BHEL, BPCL, BSE, BSOFT, CANBK, CASTROLIND, CESC, CGPOWER, CHAMBLFERT, CIPLA, COALINDIA, COCHINSHIP, COFORGE, CONCOR, DLF, DRREDDY, EIDPARRY, ETERNAL, EXIDEIND, FEDERALBNK, GABRIEL, GAIL, GATEWAY, GMRINFRA, GNFC, GSFC, HAL, HCLTECH, HDFCLIFE, HINDALCO, HUDCO, ICICIPRULI, INDHOTEL, INDUSINDBK, IOC, IRCON, IRCTC, JINDALSTEL, JSWENERGY, JSWSTEEL, JUBLFOOD, KARURVYSYA, LAURUSLABS, LICHSGFIN, LICI, LODHA, LT, LTFOODS, LUPIN, M&M, MANAPPURAM, MANINFRA, MAXHEALTH, MINDACORP, NBCC, NESTLEIND, NETWORK18, NFL, NHPC, NIACL, NITCO, NMDC, NTPC, NYKAA, OBEROIRLTY, ONGC, PERSISTENT, PFC, PNB, POLICYBZR, POWERGRID, PRAJIND, PRESTIGE, PTC, RAILTEL, RCF, RECLTD, RELIANCE, RPOWER, RVNL, SAIL, SHRIRAMFIN, SJVN, SPARC, SUNPHARMA, SWANENERGY, TATAMOTORS, TATAPOWER, TATASTEEL, TECHM, TEXRAIL, TITAGARH, UJJIVANSFB, UNIONBANK, VBL, WELCORP, WIPRO, YESBANK, ZYDUSLIFE",117
2023-12-29,"ADANIENSOL, ADANIENT, ADANIGREEN, ADANIPORTS, ADANIPOWER, ADANITRANS, AMBUJACEM, ANANTRAJ, APOLLOTYRE, ASHOKLEY, AUBANK, AUROPHARMA, AXISBANK, BAJAJFINSV, BALAJITELE, BANDHANBNK, BANKBARODA, BDL, BEL, BERGEPAINT, BHARTIARTL, BHEL, BIOCON, BPCL, BSE, BSOFT, CANBK, CANFINHOME, CASTROLIND, CENTRALBK, CESC, CGPOWER, CHAMBLFERT, CHOLAFIN, CIPLA, COALINDIA, COCHINSHIP, COFORGE, CONCOR, CROMPTON, DABUR, DCBBANK, DEVYANI, DHANBANK, DLF, DRREDDY, ETERNAL, EXIDEIND, FEDERALBNK, GAIL, GLENMARK, GMRINFRA, GNFC, GODREJCP, GRAPHITE, GREENPLY, GRSE, GSFC, HAL, HCLTECH, HDFCBANK, HFCL, HINDALCO, HINDUNILVR, HUDCO, ICICIBANK, ICICIPRULI, IDBI, IDFCFIRSTB, INDHOTEL, INDUSINDBK, INDUSTOWER, INFY, IOB, IOC, IRCON, IRCTC, IRFC, ITC, JINDALSTEL, JSWENERGY, JSWSTEEL, JUBLFOOD, KARURVYSYA, KOTAKBANK, LAURUSLABS, LICHSGFIN, LICI, LT, LTFOODS, LUPIN, M&M, MANAPPURAM, MANINFRA, MARICO, MAXHEALTH, MAZDOCK, MIDHANI, MOTHERSON, NATIONALUM, NAZARA, NBCC, NESTLEIND, NETWORK18, NFL, NHPC, NIACL, NMDC, NTPC, NYKAA, ONGC, PARADEEP, PFC, PNB, POLICYBZR, POWERGRID, PRESTIGE, PSB, PTC, RAILTEL, RBLBANK, RCF, RECLTD, RELIANCE, RPOWER, RVNL, SAIL, SBILIFE, SBIN, SHRIRAMFIN, SJVN, SONACOMS, SONATSOFTW, SOUTHBANK, SPARC, SUNPHARMA, SWANENERGY, TATACHEM, TATAMOTORS, TATAPOWER, TATASTEEL, TCS, TECHM, TEXRAIL, TITAGARH, UJJIVANSFB, UNIONBANK, VBL, VOLTAS, WIPRO, YESBANK, ZEEL, ZYDUSLIFE",153
