date,stocks,count
2015-10-30,"ASHOKLEY, AUROPHARMA, BAJFINANCE, BEL, BIOCON, BPCL, CIPLA, COFORGE, DRREDDY, HDFCBANK, IDBI, INDUSINDBK, INFY, INTELLECT, IOC, KOTAKBANK, LICHSGFIN, PRAJIND, RAJESHEXPO, RELIANCE, ZEEL, ZYDUSLIFE",22
2015-11-30,"ASHOKLEY, AUROPHARMA, BAJFINANCE, BANKBARODA, BEL, BIOCON, BPCL, CGPOWER, COFORGE, HAVELLS, HDFCBANK, HFCL, IDBI, INTELLECT, IOC, LICHSGFIN, LTFOODS, M&M, MARICO, MARUTI, NBCC, PETRONET, RADICO, RCOM, RELIANCE, TITAGARH, TVSMOTOR, WELCORP, ZEEL",29
2015-12-31,"APLAPOLLO, AUROPHARMA, BAJFINANCE, BEL, BIOCON, CGPOWER, HAVELLS, HDFCBANK, HFCL, IDBI, INDHOTEL, INDUSTOWER, INFY, INTELLECT, IOC, JSWSTEEL, LICHSGFIN, MANINFRA, MARICO, NETWORK18, NHPC, PETRONET, PRAJIND, RCOM, RELIANCE, SJVN, TATAELXSI, TITAGARH, TVSMOTOR, VOLTAS, ZEEL",31
2016-01-29,"ASIANPAINT, AUROPHARMA, BAJFINANCE, BIOCON, HAVELLS, HFCL, INFY, JSWSTEEL, MARICO, NHPC, PETRONET, PRAJIND, RELIANCE, TATAELXSI, TORNTPOWER, TVSMOTOR, ZEEL",17
2016-02-29,"JSWSTEEL, MARICO",2
2016-03-31,"ADANIPOWER, AMBUJACEM, APOLLOTYRE, ASHOKLEY, ASIANPAINT, BAJFINANCE, BEL, BIOCON, BPCL, BSOFT, DLF, GODREJCP, HAVELLS, HDFCBANK, HINDUNILVR, HINDZINC, INDUSINDBK, INFY, INTELLECT, ITC, JSWSTEEL, KOTAKBANK, LICHSGFIN, MANAPPURAM, MARICO, NHPC, PETRONET, RELIANCE, RPOWER, SHRIRAMFIN, TATASTEEL, TORNTPOWER, TVSMOTOR, YESBANK",34
2016-04-29,"ADANIPOWER, ASHOKLEY, BAJFINANCE, BIOCON, BPCL, BSOFT, DELTACORP, DLF, HAVELLS, HDFCBANK, HFCL, HINDZINC, INDUSINDBK, INFY, IOC, ITC, JSWSTEEL, MANAPPURAM, MARICO, NATIONALUM, NBCC, NTPC, PETRONET, POWERGRID, RPOWER, SHRIRAMFIN, TATAELXSI, TATASTEEL, TVSMOTOR, YESBANK, ZEEL",31
2016-05-31,"ASHOKLEY, ASIANPAINT, AUROPHARMA, BAJFINANCE, BIOCON, BPCL, BSOFT, CGPOWER, DLF, EXIDEIND, GAIL, HAVELLS, HDFCBANK, HINDZINC, INDUSINDBK, INFY, ITC, JSWSTEEL, KOTAKBANK, MANAPPURAM, NHPC, NTPC, PETRONET, PIDILITIND, POWERGRID, RPOWER, SHRIRAMFIN, TATAMOTORS, TATAPOWER, TATASTEEL, TCS, TITAN, UPL, VGUARD, VOLTAS, YESBANK, ZEEL",37
2016-06-30,"ADANIENT, ADANIPOWER, AMBUJACEM, ANANTRAJ, AXISBANK, BAJAJFINSV, BAJFINANCE, BEL, BHARTIARTL, BIOCON, BPCL, BSOFT, CENTRALBK, CESC, CGPOWER, CHOLAFIN, DABUR, DELTACORP, DLF, EXIDEIND, GAIL, GMRINFRA, HAVELLS, HDFCBANK, HFCL, HINDALCO, HINDUNILVR, IOC, ITC, JSWENERGY, JSWSTEEL, KOTAKBANK, LICHSGFIN, M&M, MANAPPURAM, MANINFRA, MFSL, NHPC, NTPC, PETRONET, POWERGRID, PTC, RCF, RPOWER, SHRIRAMFIN, TATAMOTORS, TATAPOWER, TITAN, TVSMOTOR, VEDL, VOLTAS, WIPRO, YESBANK, ZEEL",54
2016-07-29,"ADANIENSOL, ADANITRANS, AMBUJACEM, ANANTRAJ, ASIANPAINT, AUROPHARMA, AXISBANK, BAJAJFINSV, BAJFINANCE, BEL, BHARTIARTL, BIOCON, BPCL, CESC, CGPOWER, COROMANDEL, DELTACORP, DLF, EXIDEIND, GAIL, GMRINFRA, HAVELLS, HDFCBANK, HINDALCO, HINDUNILVR, HINDZINC, INDHOTEL, INDUSINDBK, IOC, ITC, JINDALSTEL, JSWSTEEL, KOTAKBANK, LICHSGFIN, LT, LTFOODS, M&M, MANAPPURAM, MARICO, MFSL, MOTHERSON, NATIONALUM, NBCC, NHPC, NMDC, NTPC, PETRONET, POWERGRID, PTC, RELIANCE, RPOWER, SHRIRAMFIN, TATAMOTORS, TATASTEEL, UPL, VEDL, VOLTAS, YESBANK, ZEEL",59
2016-08-31,"ADANIENSOL, ADANITRANS, AMBUJACEM, ANANTRAJ, APOLLOTYRE, AXISBANK, BAJAJFINSV, BAJFINANCE, BIOCON, BPCL, CANBK, CASTROLIND, CENTRALBK, CESC, CGPOWER, DELTACORP, EXIDEIND, FEDERALBNK, GAIL, GMRINFRA, HAVELLS, HDFCBANK, HINDALCO, HINDZINC, INDIANB, IOC, ITC, JINDALSTEL, JSWSTEEL, KOTAKBANK, LICHSGFIN, MANAPPURAM, MANINFRA, MARICO, MOTHERSON, MUTHOOTFIN, NBCC, NHPC, NMDC, NTPC, PETRONET, PFC, POWERGRID, PRAJIND, PTC, RAIN, RECLTD, RELIANCE, RPOWER, SAIL, SBIN, SOUTHBANK, SRF, TATACHEM, TATACOMM, TATAMOTORS, TATAPOWER, TATASTEEL, TITAGARH, TITAN, TVSMOTOR, UPL, VEDL, VOLTAS, YESBANK, ZEEL",66
2016-09-30,"ADANIPORTS, AEGISLOG, APOLLOTYRE, AUROPHARMA, BAJAJFINSV, BAJFINANCE, BANKBARODA, BEL, BIOCON, BPCL, CANBK, CASTROLIND, CHOLAFIN, DCBBANK, DELTACORP, DHANBANK, EXIDEIND, FEDERALBNK, GLOBUSSPR, GSFC, HAVELLS, HDFCBANK, HINDALCO, HINDZINC, IDFCFIRSTB, INDUSINDBK, IOC, LICHSGFIN, MANAPPURAM, NBCC, NITCO, NMDC, ONGC, PETRONET, PFC, PNB, RADICO, RAYMOND, RECLTD, RELIANCE, SBIN, SRF, TATACHEM, TATACOMM, TATAMOTORS, TATAPOWER, TATASTEEL, TVSMOTOR, UPL, VEDL, VOLTAS, ZEEL",52
2016-10-28,"ADANIENSOL, ADANIPORTS, ADANITRANS, BAJAJFINSV, BPCL, CANBK, CASTROLIND, DABUR, DCBBANK, DELTACORP, DRREDDY, EXIDEIND, FEDERALBNK, GAIL, GNFC, GSFC, HINDZINC, ICICIBANK, IDFCFIRSTB, IOC, KOTAKBANK, LICHSGFIN, LT, MANAPPURAM, MANINFRA, MOTHERSON, NATIONALUM, NHPC, NMDC, ONGC, PETRONET, PFC, PIDILITIND, PNB, RADICO, RAIN, RAYMOND, RECLTD, SAIL, SBIN, SJVN, SOUTHBANK, SRF, TATACOMM, TATAPOWER, TATASTEEL, TVSMOTOR, UNIONBANK, UPL, VEDL, VGUARD, VOLTAS",52
2016-11-30,"ADANIENSOL, ADANIPORTS, ADANIPOWER, ADANITRANS, BANKBARODA, BEL, BPCL, CANBK, CGPOWER, DRREDDY, GAIL, GNFC, GSFC, HINDALCO, HINDZINC, INDUSTOWER, IOC, JSWSTEEL, LICHSGFIN, NATIONALUM, NHPC, NMDC, NTPC, ONGC, PETRONET, PFC, POWERGRID, RECLTD, SAIL, SBIN, TATACOMM, TATASTEEL, TECHM, TVSMOTOR, UNIONBANK, VEDL",36
2016-12-30,"ADANIENSOL, ADANIENT, ADANIPOWER, ADANITRANS, BEL, BIOCON, CESC, CIPLA, GAIL, GSFC, HCLTECH, IOC, ITC, LICHSGFIN, MOTHERSON, NATIONALUM, NBCC, NHPC, NTPC, POWERGRID, RELIANCE, SONATSOFTW, SWANENERGY, TATACHEM, TATAPOWER, TECHM, TITAGARH",27
2017-01-31,"ADANIENT, ADANIPORTS, ADANIPOWER, BAJFINANCE, BANKBARODA, BEL, BEML, BHARTIARTL, BHEL, BIOCON, BPCL, CESC, CHAMBLFERT, DCBBANK, DELTACORP, EXIDEIND, FEDERALBNK, GAIL, GMRINFRA, GNFC, GRASIM, GSFC, HAVELLS, HDFCBANK, HINDALCO, HINDZINC, ICICIBANK, IDBI, INDUSINDBK, IOC, ITC, JINDALSTEL, JSWSTEEL, KOTAKBANK, LICHSGFIN, LT, LTFOODS, MANAPPURAM, MOTHERSON, NATIONALUM, NBCC, NFL, NHPC, NMDC, NTPC, ONGC, PETRONET, PFC, PNB, POWERGRID, PTC, RAIN, RCF, RECLTD, RELIANCE, SAIL, SBIN, SONATSOFTW, SRF, SWANENERGY, TATACHEM, TATACOMM, TATAMOTORS, TATAPOWER, TATASTEEL, TVSMOTOR, UNIONBANK, UPL, VEDL, VGUARD, YESBANK, ZEEL",72
2017-02-28,"ABFRL, ADANIENT, ADANIPORTS, ADANIPOWER, APOLLOTYRE, BAJAJFINSV, BAJFINANCE, BANKBARODA, BEL, BHEL, BIOCON, CANBK, CESC, CHAMBLFERT, CIPLA, COALINDIA, DCBBANK, DELTACORP, DHANBANK, DLF, EXIDEIND, FEDERALBNK, GAIL, GMRINFRA, GRASIM, HAVELLS, HCLTECH, HDFCBANK, HINDALCO, HINDZINC, ICICIBANK, IDBI, IDFCFIRSTB, INDUSINDBK, IOC, ITC, JINDALSTEL, JSWSTEEL, KARURVYSYA, KOTAKBANK, LICHSGFIN, LT, LTFOODS, MANAPPURAM, MARICO, MOTHERSON, NATIONALUM, NFL, NHPC, NMDC, PETRONET, PFC, PNB, PTC, RADICO, RAIN, RAYMOND, RCF, RECLTD, RELIANCE, SAIL, SBIN, SJVN, SOUTHBANK, TATACHEM, TATACOMM, TATAPOWER, TATASTEEL, TECHM, TITAN, TVSMOTOR, UNIONBANK, UPL, VEDL, VOLTAS, YESBANK, ZEEL, ZYDUSLIFE",78
2017-03-31,"ABFRL, ADANIENT, ADANIPORTS, ADANIPOWER, APOLLOTYRE, BAJFINANCE, BANKBARODA, BEL, BHEL, BIOCON, CANBK, CASTROLIND, CENTRALBK, CESC, CGPOWER, CIPLA, CROMPTON, DCBBANK, DELTACORP, DHANBANK, DLF, EXIDEIND, FEDERALBNK, GAIL, GMRINFRA, GRASIM, HCLTECH, HDFCBANK, HINDALCO, HINDUNILVR, INDHOTEL, INDUSINDBK, IOC, ITC, JINDALSTEL, JSWSTEEL, JUBLFOOD, KARURVYSYA, KEC, KOTAKBANK, LICHSGFIN, LT, MANAPPURAM, MANINFRA, MARICO, MOTHERSON, NATIONALUM, NFL, NHPC, PETRONET, PFC, PNB, PTC, RAIN, RAYMOND, RCF, RECLTD, RELIANCE, SBIN, SOUTHBANK, TATACHEM, TATAPOWER, TATASTEEL, TITAN, TORNTPOWER, TVSMOTOR, UNIONBANK, UPL, VEDL, VOLTAS, YESBANK, ZEEL",72
2017-04-28,"ABFRL, ADANIENSOL, ADANIENT, ADANIPORTS, ADANITRANS, ANANTRAJ, APOLLOTYRE, BAJAJFINSV, BAJFINANCE, BANKBARODA, BEL, BHEL, BPCL, CANBK, CASTROLIND, CESC, CGPOWER, CHAMBLFERT, CHOLAFIN, CONCOR, CROMPTON, DCBBANK, DHANBANK, DLF, EXIDEIND, FEDERALBNK, GAIL, GMRINFRA, GRASIM, GSFC, HDFCBANK, HINDALCO, HINDUNILVR, ICICIBANK, IDBI, IDFCFIRSTB, INDIANB, INDUSINDBK, IOB, IOC, ITC, JSWSTEEL, KARURVYSYA, KOTAKBANK, LICHSGFIN, LT, MANINFRA, MARICO, MFSL, MOTHERSON, MUTHOOTFIN, NBCC, NETWORK18, NFL, NHPC, NTPC, PETRONET, PFC, PNB, POWERGRID, PTC, RAIN, RAYMOND, RCF, RECLTD, RELIANCE, SBIN, SOUTHBANK, SRF, TATACHEM, TITAN, TORNTPOWER, TVSMOTOR, UNIONBANK, UPL, VOLTAS, YESBANK, ZEEL",78
2017-05-31,"ABFRL, ADANIENSOL, ADANIPORTS, ADANITRANS, ANANTRAJ, APOLLOTYRE, ASHOKLEY, BAJFINANCE, BEL, BHARTIARTL, BPCL, CANBK, CESC, CGPOWER, CHAMBLFERT, COFORGE, CROMPTON, DCBBANK, DHANBANK, DLF, FEDERALBNK, GAIL, GODREJCP, GRASIM, GSFC, HAVELLS, HCLTECH, HDFCBANK, HINDALCO, HINDUNILVR, ICICIBANK, INDIANB, IOC, ITC, JINDALSTEL, JSWSTEEL, KOTAKBANK, LICHSGFIN, LT, LTFOODS, MANINFRA, MARICO, MOTHERSON, NBCC, NETWORK18, NFL, PETRONET, POWERGRID, RCF, SOUTHBANK, TATACHEM, TATACOMM, TATASTEEL, TVSMOTOR, UPL, VOLTAS, ZYDUSLIFE",57
2017-06-30,"ABFRL, ADANIENSOL, ADANIENT, ADANIPORTS, ADANITRANS, ASHOKLEY, BAJFINANCE, BHARTIARTL, CHOLAFIN, COFORGE, DCBBANK, DHANBANK, FEDERALBNK, GMRINFRA, GRASIM, HCLTECH, HDFCBANK, HINDUNILVR, ICICIBANK, INDUSTOWER, ITC, JINDALSTEL, JSWSTEEL, KARURVYSYA, KOTAKBANK, LICHSGFIN, MANAPPURAM, MANINFRA, MFSL, MOTHERSON, NBCC, POWERGRID, RAIN, RELIANCE, SAREGAMA, SOUTHBANK, TATACOMM, TATAELXSI, TATASTEEL, TITAN, TVSMOTOR, UPL, VEDL, VOLTAS, ZYDUSLIFE",45
2017-07-31,"ADANIENT, ADANIPORTS, ADANIPOWER, AMBUJACEM, ANANTRAJ, APOLLOTYRE, ASHOKLEY, BAJAJFINSV, BAJFINANCE, BALAJITELE, BEL, BHARTIARTL, BIOCON, BPCL, CANBK, CESC, CGPOWER, CHAMBLFERT, DABUR, DHANBANK, DLF, FEDERALBNK, GMRINFRA, GRAPHITE, GRASIM, GSFC, HCLTECH, HDFCBANK, HFCL, HINDALCO, HINDUNILVR, HINDZINC, ICICIBANK, ICICIPRULI, INDIANB, INDUSINDBK, INDUSTOWER, JINDALSTEL, JSWSTEEL, JUBLFOOD, KARURVYSYA, KEC, KOTAKBANK, LT, M&M, MANAPPURAM, MANINFRA, MOTHERSON, NATIONALUM, NBCC, NETWORK18, NTPC, PNB, POWERGRID, PTC, RAIN, RAYMOND, RBLBANK, RCF, RELIANCE, SAIL, SAREGAMA, SBIN, SOUTHBANK, TATAELXSI, TATAPOWER, TATASTEEL, TCS, TITAN, UNIONBANK, UPL, VEDL, VOLTAS, WELCORP, WIPRO, YESBANK, ZYDUSLIFE",77
2017-08-31,"ADANIENT, ADANIPORTS, ADANIPOWER, AMBUJACEM, ASHOKLEY, BAJAJFINSV, BAJFINANCE, BATAINDIA, BEL, BEML, BHARTIARTL, BPCL, CESC, CHAMBLFERT, CIPLA, CONCOR, DABUR, DELTACORP, GAIL, GRAPHITE, GRASIM, GSFC, HAVELLS, HDFCBANK, HFCL, HINDALCO, HINDZINC, ICICIBANK, IOC, JINDALSTEL, JSWENERGY, JSWSTEEL, JUBLFOOD, KARURVYSYA, MANINFRA, NATIONALUM, NESTLEIND, NTPC, PETRONET, POWERGRID, PTC, RAIN, RAYMOND, RBLBANK, RCF, RELIANCE, SAIL, SAREGAMA, TATASTEEL, TCS, TITAN, TORNTPOWER, TVSMOTOR, VBL, VEDL, VOLTAS, WIPRO, YESBANK",58
2017-09-29,"ASHOKLEY, AXISBANK, BAJFINANCE, CESC, CIPLA, COFORGE, CONCOR, DELTACORP, FEDERALBNK, GAIL, GNFC, GRAPHITE, HDFCBANK, HFCL, HINDALCO, HINDZINC, INDUSINDBK, INDUSTOWER, JSWENERGY, JSWSTEEL, JUBLFOOD, KARURVYSYA, KOTAKBANK, MINDACORP, MOTHERSON, MUTHOOTFIN, NATIONALUM, NBCC, NESTLEIND, NITCO, PETRONET, PTC, RADICO, RAIN, RAYMOND, SHRIRAMFIN, TATACHEM, TATASTEEL, TORNTPOWER, TVSMOTOR, VEDL",41
2017-10-31,"ADANIENSOL, ADANIENT, ADANIPORTS, ADANITRANS, AMBUJACEM, ANANTRAJ, ASHOKLEY, AUROPHARMA, AXISBANK, BANKBARODA, BEL, BHARTIARTL, BHEL, BIOCON, BPCL, BSOFT, CANBK, CGPOWER, CHOLAFIN, CIPLA, COFORGE, CONCOR, DABUR, DELTACORP, DIVISLAB, DLF, FEDERALBNK, GAIL, GMRINFRA, GNFC, GRAPHITE, GSFC, HDFCBANK, HFCL, HINDALCO, HINDUNILVR, HINDZINC, ICICIBANK, INDIANB, INDUSTOWER, JINDALSTEL, JSWENERGY, JSWSTEEL, JUBLFOOD, JUSTDIAL, KOTAKBANK, LT, M&M, MOTHERSON, NATIONALUM, NBCC, NETWORK18, NTPC, PETRONET, PFC, PNB, PTC, RADICO, RAIN, RAYMOND, RBLBANK, RECLTD, RELIANCE, SAIL, SAREGAMA, SBIN, SHRIRAMFIN, SJVN, SOUTHBANK, SRF, TATACHEM, TATAPOWER, TATASTEEL, TCS, TECHM, TEXRAIL, TITAGARH, TITAN, TORNTPOWER, UNIONBANK, VEDL, VGUARD, VOLTAS, WIPRO, ZEEL",85
2017-11-30,"ABFRL, ADANIENT, ANANTRAJ, APOLLOTYRE, AXISBANK, BAJAJFINSV, BEL, BHARTIARTL, BIOCON, BSOFT, CANBK, CGPOWER, CHOLAFIN, COFORGE, CROMPTON, DABUR, DCBBANK, DELTACORP, DIVISLAB, DLF, GAIL, GMRINFRA, GNFC, GRAPHITE, HAVELLS, HDFCBANK, HFCL, HINDUNILVR, ICICIBANK, INDHOTEL, INDIANB, INFY, JINDALSTEL, JSWENERGY, JUBLFOOD, JUSTDIAL, LT, M&M, MANAPPURAM, MINDACORP, MOTHERSON, NBCC, NESTLEIND, NETWORK18, NTPC, PETRONET, PIDILITIND, PNB, PRAJIND, RADICO, RAIN, RAYMOND, RCF, RELIANCE, SAIL, SAREGAMA, SBIN, SHRIRAMFIN, SONATSOFTW, SOUTHBANK, SRF, TATACHEM, TATAPOWER, TATASTEEL, TCS, TECHM, TEXRAIL, TITAGARH, TITAN, TORNTPOWER, UNIONBANK, VBL, VGUARD, VOLTAS, ZEEL",75
2017-12-29,"ABFRL, ADANIENSOL, ADANIENT, ADANIPOWER, ADANITRANS, AMBUJACEM, ANANTRAJ, APOLLOTYRE, AXISBANK, BAJAJFINSV, BEL, BHARTIARTL, BIOCON, BPCL, BSOFT, CESC, CGPOWER, CHOLAFIN, CIPLA, COFORGE, DCBBANK, DELTACORP, DLF, EXIDEIND, GAIL, GMRINFRA, GNFC, GRAPHITE, GSFC, HAVELLS, HCLTECH, HDFCBANK, HINDALCO, HINDUNILVR, HINDZINC, ICICIBANK, INFY, JINDALSTEL, JSWENERGY, JSWSTEEL, JUBLFOOD, KARURVYSYA, LT, LTFOODS, M&M, MANAPPURAM, MANINFRA, MOTHERSON, NATIONALUM, NETWORK18, NFL, NHPC, NITCO, ONGC, PIDILITIND, PRAJIND, PTC, RADICO, RAIN, RAYMOND, RCF, RPOWER, SAIL, SAREGAMA, SHRIRAMFIN, SONATSOFTW, SRF, TATACHEM, TATAPOWER, TATASTEEL, TCS, TECHM, TITAGARH, TITAN, TORNTPOWER, VBL, VEDL, VGUARD, VOLTAS, WIPRO, ZEEL",81
2018-01-31,"ADANIENT, ADANIPORTS, APLAPOLLO, ASHOKLEY, AXISBANK, BIOCON, BSOFT, CGPOWER, COALINDIA, COFORGE, CONCOR, DABUR, DELTACORP, DLF, GMRINFRA, GNFC, GODREJCP, GRAPHITE, HCLTECH, HDFCBANK, HINDUNILVR, HINDZINC, ICICIBANK, INDHOTEL, INDUSINDBK, INFY, JINDALSTEL, JSWENERGY, JSWSTEEL, JUBLFOOD, KOTAKBANK, LT, LTFOODS, M&M, NETWORK18, NMDC, ONGC, PETRONET, RADICO, RAYMOND, RCF, RELIANCE, SAIL, SONATSOFTW, SWANENERGY, TATASTEEL, TCS, TECHM, TITAN, TORNTPOWER, VBL, VEDL, WELCORP, WIPRO, YESBANK, ZEEL",56
2018-02-28,"ADANIENT, APOLLOTYRE, ASHOKLEY, BIOCON, BSOFT, CANFINHOME, CHAMBLFERT, CHOLAFIN, COALINDIA, COFORGE, DELTACORP, HCLTECH, HINDZINC, INDHOTEL, INFY, IPCALAB, JINDALSTEL, JSWSTEEL, JUBLFOOD, KEC, KOTAKBANK, LTFOODS, NESTLEIND, PIDILITIND, RADICO, RELIANCE, SONATSOFTW, TCS, TECHM, VEDL, VGUARD",31
2018-03-28,"APOLLOTYRE, ASHOKLEY, BAJAJFINSV, BAJFINANCE, BSOFT, CHOLAFIN, COFORGE, GRAPHITE, HCLTECH, IDBI, INDUSINDBK, JUBLFOOD, MARICO, NESTLEIND, NETWORK18, SHRIRAMFIN, TECHM, TITAN, VOLTAS",19
2018-04-30,"ADANIPORTS, APOLLOTYRE, ASHOKLEY, BAJAJFINSV, BAJFINANCE, BIOCON, BSOFT, CESC, CHAMBLFERT, CHOLAFIN, CIPLA, COFORGE, DABUR, DLF, EXIDEIND, GMRINFRA, GNFC, HAVELLS, HCLTECH, HDFCBANK, HFCL, HINDZINC, INDHOTEL, INDIGO, INFY, JINDALSTEL, JSWENERGY, JSWSTEEL, JUBLFOOD, KOTAKBANK, LT, M&M, MANAPPURAM, MARICO, MOTHERSON, NATIONALUM, NESTLEIND, NTPC, PIDILITIND, PRAJIND, RADICO, RAYMOND, RELIANCE, SAIL, SHRIRAMFIN, SRF, TATACHEM, TATAELXSI, TATAPOWER, TCS, TECHM, TITAN, VBL, VGUARD, VOLTAS, YESBANK, ZEEL",57
2018-05-31,"ASIANPAINT, AXISBANK, BAJAJFINSV, BAJFINANCE, BERGEPAINT, BIOCON, BSOFT, COALINDIA, COFORGE, CONCOR, DABUR, DCBBANK, DMART, EXIDEIND, GAIL, GNFC, GRAPHITE, HAVELLS, HDFCBANK, HINDUNILVR, INDIANB, INDUSINDBK, INFY, JSWENERGY, JSWSTEEL, JUBLFOOD, JUSTDIAL, KOTAKBANK, LT, M&M, MPHASIS, NESTLEIND, PIDILITIND, PRAJIND, RADICO, SAIL, SAREGAMA, TATACHEM, TCS, TECHM, VBL",41
2018-06-29,"BAJAJFINSV, BAJFINANCE, BATAINDIA, BSOFT, CIPLA, COFORGE, DABUR, EXIDEIND, GLENMARK, HAVELLS, HDFCBANK, HFCL, HINDUNILVR, INDIANB, INFY, JUBLFOOD, JUSTDIAL, KOTAKBANK, M&M, MARICO, NESTLEIND, RBLBANK, RELIANCE, SAIL, SUNPHARMA, TCS, VBL",27
2018-07-31,"ADANIENT, ADANIPOWER, APOLLOTYRE, ASIANPAINT, AXISBANK, BAJAJFINSV, BAJFINANCE, BANKBARODA, BATAINDIA, BERGEPAINT, BSOFT, CIPLA, COFORGE, DABUR, EXIDEIND, GAIL, HAVELLS, HCLTECH, HDFCBANK, HINDUNILVR, ICICIBANK, ICICIPRULI, INDIANB, INDUSINDBK, INFY, ITC, JSWSTEEL, JUBLFOOD, M&M, MARICO, RBLBANK, RELIANCE, SBIN, SONATSOFTW, SUNPHARMA, TCS, TECHM, TITAN, VBL",39
2018-08-31,"ABFRL, ADANIENSOL, ADANIENT, ADANIPOWER, ADANITRANS, APOLLOHOSP, AUBANK, AXISBANK, BAJAJFINSV, BAJFINANCE, BATAINDIA, BERGEPAINT, BIOCON, BSOFT, CIPLA, COALINDIA, COFORGE, DABUR, DIVISLAB, DLF, DRREDDY, EXIDEIND, GAIL, GLENMARK, GMRINFRA, GRAPHITE, HAVELLS, HCLTECH, HINDUNILVR, ICICIBANK, INDHOTEL, INFY, INTELLECT, ITC, JSWSTEEL, JUBLFOOD, LT, LUPIN, M&M, MARICO, NESTLEIND, PIDILITIND, RBLBANK, RELIANCE, SRF, SUNPHARMA, TATACHEM, TCS, TECHM, TITAN, TORNTPOWER, VBL, VGUARD, VOLTAS, WELCORP, WIPRO",56
2018-09-28,"ABFRL, AUROPHARMA, AXISBANK, BIOCON, CIPLA, DIVISLAB, DRREDDY, GAIL, GLENMARK, HCLTECH, HIKAL, INFY, JSWSTEEL, LUPIN, RELIANCE, SONATSOFTW, SUNPHARMA, TCS, TECHM, WIPRO",20
2018-10-31,"ADANIENT, AUROPHARMA, BIOCON, DIVISLAB, DRREDDY, HAVELLS, HCLTECH, ICICIBANK, NESTLEIND, TECHM, WIPRO",11
2018-11-30,"ADANIENT, ADANIPOWER, ASIANPAINT, AUROPHARMA, AXISBANK, BAJAJFINSV, BAJFINANCE, BATAINDIA, BERGEPAINT, CONCOR, DABUR, DIVISLAB, DRREDDY, EXIDEIND, GLENMARK, HAVELLS, HDFCBANK, HINDUNILVR, ICICIBANK, ITC, KOTAKBANK, LT, LUPIN, MARICO, NESTLEIND, PIDILITIND, RBLBANK, RELIANCE, SRF, TITAN, TORNTPOWER, UPL, VBL, WIPRO",34
2018-12-31,"ABFRL, ADANIPOWER, ASIANPAINT, AXISBANK, BAJAJFINSV, BAJFINANCE, BATAINDIA, BIOCON, CANBK, COFORGE, CONCOR, DABUR, DCBBANK, DRREDDY, EXIDEIND, GAIL, GLENMARK, HDFCBANK, HINDUNILVR, ICICIBANK, ITC, KOTAKBANK, LT, MARICO, MUTHOOTFIN, NESTLEIND, PFC, PIDILITIND, POWERGRID, PTC, RBLBANK, RELIANCE, SBIN, TATACHEM, TECHM, TITAN, TORNTPOWER, UPL, VBL, WIPRO",40
2019-01-31,"ABFRL, ASIANPAINT, AUROPHARMA, AXISBANK, BAJFINANCE, BIOCON, COFORGE, DABUR, DCBBANK, DRREDDY, HAVELLS, ICICIBANK, INFY, KOTAKBANK, LUPIN, MUTHOOTFIN, NESTLEIND, PFC, PRAJIND, RBLBANK, RELIANCE, SBIN, TCS, TECHM, TITAN, UPL, VBL, WIPRO",28
2019-02-28,"ABFRL, ADANIPOWER, AXISBANK, BAJAJFINSV, BAJFINANCE, BATAINDIA, COFORGE, DABUR, HAVELLS, HCLTECH, INFY, JUSTDIAL, MUTHOOTFIN, PETRONET, PFC, PIDILITIND, PRAJIND, RBLBANK, RECLTD, RELIANCE, SRF, TCS, TECHM, TITAN, UPL, VBL, WIPRO",27
2019-03-29,"ABFRL, ADANIENT, ADANIPOWER, AMBUJACEM, ASIANPAINT, AUROPHARMA, AXISBANK, BAJAJFINSV, BAJFINANCE, BEML, CANBK, COFORGE, DCBBANK, DELTACORP, DRREDDY, FEDERALBNK, GMRINFRA, HAVELLS, HCLTECH, HDFCBANK, ICICIBANK, IDFCFIRSTB, INDHOTEL, INDIGO, INDUSTOWER, INFY, ITC, JUBLFOOD, JUSTDIAL, KOTAKBANK, LICHSGFIN, LT, MANAPPURAM, MUTHOOTFIN, NESTLEIND, PETRONET, PFC, PIDILITIND, PNB, PRAJIND, RBLBANK, RECLTD, RELIANCE, SBIN, SIEMENS, SRF, TCS, TITAN, UNIONBANK, UPL, VBL, VGUARD, VOLTAS",53
2019-04-30,"ACC, ADANIPORTS, ASIANPAINT, AUROPHARMA, AXISBANK, BAJAJFINSV, BAJFINANCE, BHEL, BPCL, DCBBANK, DHANBANK, DRREDDY, FEDERALBNK, GAIL, HCLTECH, HDFCBANK, HINDUNILVR, ICICIBANK, INDHOTEL, INDIGO, INFY, IOC, ITC, JSWENERGY, KOTAKBANK, LT, MARICO, NESTLEIND, NTPC, ONGC, PETRONET, PFC, PIDILITIND, RBLBANK, RECLTD, RELIANCE, SBIN, SRF, TCS, TECHM, TITAN, UPL, VBL, VOLTAS, WIPRO",45
2019-05-31,"ADANIENT, ADANIPORTS, ADANIPOWER, AMBUJACEM, AXISBANK, BAJAJFINSV, BAJFINANCE, BEML, BERGEPAINT, BHARTIARTL, BPCL, CANFINHOME, CESC, CHOLAFIN, COFORGE, DCBBANK, DLF, FEDERALBNK, HCLTECH, HDFCBANK, HINDUNILVR, ICICIBANK, ICICIGI, INDIGO, INFY, JUSTDIAL, KOTAKBANK, LICHSGFIN, LT, MANAPPURAM, MARICO, MUTHOOTFIN, NESTLEIND, NHPC, NTPC, ONGC, PETRONET, PFC, PIDILITIND, PRAJIND, RAYMOND, RBLBANK, SBIN, SIEMENS, SRF, TCS, TITAN, UPL, VBL, VGUARD, WIPRO",51
2019-06-28,"ABFRL, ADANIENT, ADANIPORTS, ADANIPOWER, APOLLOHOSP, AXISBANK, BAJAJFINSV, BAJFINANCE, BEML, BPCL, CANFINHOME, DCBBANK, FEDERALBNK, HAVELLS, HDFCBANK, HDFCLIFE, ICICIBANK, ICICIPRULI, INDHOTEL, INFY, JUSTDIAL, KOTAKBANK, LICHSGFIN, LT, MANAPPURAM, MARICO, NESTLEIND, PETRONET, PFC, POWERGRID, PRAJIND, RECLTD, SBILIFE, SBIN, SRF, TCS, TITAN, TORNTPOWER, VBL, VGUARD, VOLTAS",41
2019-07-31,"ADANIGREEN, ADANIPOWER, ASIANPAINT, BERGEPAINT, DABUR, HDFCLIFE, ICICIBANK, ICICIPRULI, INFY, KOTAKBANK, NMDC, POWERGRID, SBILIFE, TCS, TORNTPOWER, VBL",16
2019-08-30,"ASIANPAINT, BEL, BERGEPAINT, CESC, COFORGE, DABUR, HCLTECH, HDFCLIFE, HINDUNILVR, ICICIPRULI, INDIGO, INFY, MARICO, NESTLEIND, PETRONET, PIDILITIND, SBILIFE, TCS, VBL, VOLTAS",20
2019-09-30,"ABFRL, ADANIGREEN, ADANIPORTS, ADANIPOWER, ASIANPAINT, BAJAJFINSV, BAJFINANCE, BEL, BEML, BERGEPAINT, BHARTIARTL, BPCL, CHOLAFIN, COFORGE, CONCOR, DABUR, DRREDDY, GMRINFRA, HCLTECH, HDFCBANK, HDFCLIFE, HINDUNILVR, ICICIBANK, ICICIGI, ICICIPRULI, INDHOTEL, INDIGO, INFY, IOC, JUBLFOOD, KOTAKBANK, LT, MANAPPURAM, MARICO, MUTHOOTFIN, NESTLEIND, PETRONET, PIDILITIND, RELIANCE, SBILIFE, SIEMENS, TITAN, UPL, VOLTAS",44
2019-10-31,"ABFRL, ADANIENT, ADANIGREEN, ADANIPORTS, ADANIPOWER, ASIANPAINT, AXISBANK, BAJAJFINSV, BAJFINANCE, BANDHANBNK, BEL, BEML, BERGEPAINT, BHARTIARTL, BPCL, CASTROLIND, CESC, CHOLAFIN, COFORGE, CONCOR, DABUR, DLF, DRREDDY, EICHERMOT, GMRINFRA, HCLTECH, HDFCBANK, HDFCLIFE, HINDUNILVR, ICICIBANK, ICICIGI, ICICIPRULI, INDHOTEL, IOC, JUBLFOOD, KOTAKBANK, LT, MANAPPURAM, MARUTI, NESTLEIND, NMDC, PETRONET, PIDILITIND, RECLTD, RELIANCE, SBILIFE, SBIN, SIEMENS, SRF, TATAMOTORS, TCS, TECHM, TITAN, UPL, VOLTAS",55
2019-11-29,"ABCAPITAL, ABFRL, ADANIENT, ADANIGREEN, AUBANK, AXISBANK, BAJAJFINSV, BAJFINANCE, BANDHANBNK, BERGEPAINT, BHARTIARTL, BPCL, CHOLAFIN, DABUR, DLF, DRREDDY, EICHERMOT, GMRINFRA, HCLTECH, HDFCAMC, HDFCBANK, ICICIBANK, ICICIPRULI, IDFCFIRSTB, INDUSINDBK, IRCON, JINDALSTEL, JSWENERGY, JUBLFOOD, KOTAKBANK, MANAPPURAM, MFSL, MUTHOOTFIN, NESTLEIND, NMDC, PETRONET, PFC, RELIANCE, SBILIFE, SBIN, SHRIRAMFIN, SJVN, SPARC, SRF, SUNPHARMA, TECHM, VBL, VOLTAS, WELCORP",49
2019-12-31,"ABCAPITAL, ABFRL, ADANIENT, ADANIGREEN, ASIANPAINT, AXISBANK, BAJAJFINSV, BAJFINANCE, BERGEPAINT, BHARTIARTL, COFORGE, DLF, DRREDDY, EICHERMOT, GATEWAY, GMRINFRA, HCLTECH, HDFCBANK, HDFCLIFE, HINDALCO, ICICIBANK, JINDALSTEL, JUBLFOOD, KOTAKBANK, MANAPPURAM, MFSL, MUTHOOTFIN, NESTLEIND, NHPC, NMDC, PFC, RECLTD, RELIANCE, SBIN, SHRIRAMFIN, SRF, TATACHEM, TATAMOTORS, TCS, VBL",40
2020-01-31,"ABFRL, ADANIENT, ADANIGREEN, ANANTRAJ, ASIANPAINT, AUBANK, BAJAJFINSV, BAJFINANCE, BERGEPAINT, BHARTIARTL, CANFINHOME, CHOLAFIN, COFORGE, DABUR, DLF, DRREDDY, GMRINFRA, HCLTECH, HINDUNILVR, ICICIPRULI, INFY, IRCON, JUBLFOOD, KOTAKBANK, LAURUSLABS, MANAPPURAM, NESTLEIND, NHPC, PIDILITIND, RAIN, SPARC, TATACHEM, TECHM, TITAN, TORNTPOWER, VBL, VOLTAS",37
2020-02-28,"ABFRL, AUBANK, BAJFINANCE, BALKRISIND, BERGEPAINT, BHARTIARTL, BSOFT, CROMPTON, DABUR, DMART, HINDUNILVR, IRCON, LAURUSLABS, MFSL, MIDHANI, MUTHOOTFIN, NESTLEIND, SHRIRAMFIN, SRF, TITAN, VBL, WELCORP",22
2020-03-31,"DRREDDY, HINDUNILVR, IPCALAB, NESTLEIND, ZYDUSLIFE",5
2020-04-30,"ASIANPAINT, AUROPHARMA, BHARTIARTL, BIOCON, BRITANNIA, CIPLA, COLPAL, DABUR, DEEPAKNTR, DIVISLAB, DRREDDY, HCLTECH, IPCALAB, JUBLFOOD, LAURUSLABS, LUPIN, MFSL, MIDHANI, MUTHOOTFIN, NESTLEIND, PIDILITIND, RELIANCE, SRF, SUNPHARMA, TATACHEM, TORNTPHARM, TORNTPOWER, ZYDUSLIFE",28
2020-05-29,"AUROPHARMA, BERGEPAINT, BHARTIARTL, BIOCON, CIPLA, COLPAL, DABUR, DEEPAKNTR, DRREDDY, HCLTECH, IRCON, JUBLFOOD, LAURUSLABS, LUPIN, MFSL, MUTHOOTFIN, NESTLEIND, PETRONET, PIDILITIND, RADICO, RELIANCE, SRF, SUNPHARMA, TATACHEM, TORNTPHARM, TORNTPOWER, ZYDUSLIFE",27
2020-06-30,"ADANIENSOL, ADANIGREEN, ADANITRANS, AMBUJACEM, APOLLO, AUROPHARMA, BDL, BHARTIARTL, BIOCON, BSOFT, CIPLA, DABUR, DHANBANK, DRREDDY, EICHERMOT, GLENMARK, GMRINFRA, GODREJCP, HINDUNILVR, IDBI, IOB, IRCON, JINDALSTEL, JUBLFOOD, LAURUSLABS, LTFOODS, LUPIN, M&M, MANAPPURAM, MFSL, MIDHANI, MUTHOOTFIN, NESTLEIND, NETWORK18, NFL, RCF, RCOM, RELIANCE, RPOWER, SPARC, SRF, TATACHEM, TORNTPOWER, ZYDUSLIFE",44
2020-07-31,"AMBUJACEM, APOLLO, AUBANK, AUROPHARMA, BDL, BERGEPAINT, BIOCON, BRITANNIA, BSOFT, CENTRALBK, CHAMBLFERT, CIPLA, COFORGE, DABUR, DEEPAKNTR, DIVISLAB, DRREDDY, EICHERMOT, GLENMARK, GMRINFRA, GODREJCP, HAL, HCLTECH, HDFCLIFE, HEROMOTOCO, HIKAL, HINDUNILVR, HINDZINC, HUDCO, ICICIPRULI, IDBI, INFY, IOB, IRCON, JINDALSTEL, JUBLFOOD, LAURUSLABS, LTFOODS, LUPIN, M&M, MANAPPURAM, MFSL, MUTHOOTFIN, NETWORK18, NFL, RAIN, RCF, RCOM, RELIANCE, RPOWER, SBILIFE, SPARC, SRF, SUNPHARMA, TCS, TORNTPHARM, VBL, WIPRO, ZYDUSLIFE",59
2020-08-31,"ADANIENT, ADANIGREEN, AMBUJACEM, APOLLO, ASIANPAINT, BDL, BERGEPAINT, BSOFT, CGPOWER, CIPLA, COFORGE, DEEPAKNTR, DIVISLAB, DRREDDY, GLENMARK, GMRINFRA, GNFC, HCLTECH, HEROMOTOCO, HIKAL, HINDZINC, INFY, JINDALSTEL, JSWSTEEL, JUBLFOOD, LAURUSLABS, LTFOODS, LUPIN, M&M, MANINFRA, MFSL, PTC, RAIN, RCOM, RELIANCE, SAIL, SPARC, SRF, SUNPHARMA, TATACHEM, TATAPOWER, TATASTEEL, TCS, TORNTPHARM, TORNTPOWER, VBL, WIPRO",47
2020-09-30,"ADANIENT, ADANIGREEN, AMBUJACEM, APLAPOLLO, APOLLOHOSP, ASIANPAINT, BERGEPAINT, BIOCON, BSE, BSOFT, CGPOWER, CHAMBLFERT, CIPLA, COFORGE, CROMPTON, DABUR, DEEPAKNTR, DIVISLAB, DRREDDY, GLENMARK, GMRINFRA, GNFC, GODREJCP, HAVELLS, HCLTECH, HEROMOTOCO, HIKAL, INFY, IRCTC, JSWSTEEL, JUBLFOOD, LAURUSLABS, LTFOODS, LUPIN, MFSL, NATCOPHARM, RELIANCE, SONATSOFTW, SRF, SYNGENE, TCS, TECHM, TITAN, TORNTPHARM, TVSMOTOR, WIPRO, ZYDUSLIFE",47
2020-10-30,"ACC, ADANIENT, AMBUJACEM, APOLLOHOSP, ASIANPAINT, BERGEPAINT, CGPOWER, CROMPTON, DABUR, DRREDDY, GODREJPROP, GRASIM, HAVELLS, HCLTECH, INFY, JSWSTEEL, JUSTDIAL, LAURUSLABS, LTFOODS, MUTHOOTFIN, NESTLEIND, PIDILITIND, RPOWER, SRF, TATACHEM, TCS, TECHM, VOLTAS, WIPRO, ZYDUSLIFE",30
2020-11-27,"ACC, ADANIENT, ADANIGREEN, ADANIPORTS, AMBUJACEM, APOLLO, APOLLOHOSP, APOLLOTYRE, ASHOKLEY, ASIANPAINT, AUROPHARMA, BAJFINANCE, BALKRISIND, BEL, BERGEPAINT, CGPOWER, CHOLAFIN, COFORGE, COLPAL, CROMPTON, CUMMINSIND, DIVISLAB, EICHERMOT, EXIDEIND, GMRINFRA, GODREJCP, GODREJPROP, GRASIM, HAL, HAVELLS, HDFCBANK, HDFCLIFE, HEROMOTOCO, HFCL, HINDALCO, HINDZINC, IDBI, INDIGO, INFY, IOB, IPCALAB, JINDALSTEL, JSWSTEEL, JUBLFOOD, JUSTDIAL, KOTAKBANK, LAURUSLABS, LTFOODS, M&M, MANAPPURAM, MARICO, MARUTI, MFSL, MOTHERSON, NESTLEIND, POWERGRID, RAIN, RCF, RPOWER, SAIL, SIEMENS, SRF, SUNPHARMA, TATACHEM, TATAMOTORS, TATAPOWER, TATASTEEL, TCS, TECHM, TITAN, TORNTPOWER, TRENT, TVSMOTOR, VBL, VOLTAS, WIPRO, ZYDUSLIFE",77
