date,stocks,count
2024-01-31,"ABFRL, ADANIENSOL, ADANIENT, ADANIGREEN, ADANIPORTS, ADANIPOWER, ADANITRANS, AMBUJACEM, ANANTRAJ, APOLLOTYRE, ASHOKLEY, AUROPHARMA, BALAJITELE, BANKBARODA, BDL, BEL, BHARTIARTL, BHEL, BIOCON, BPCL, BSE, BSOFT, CANBK, CASTROLIND, CENTRALBK, CESC, CGPOWER, CHAMBLFERT, CIPLA, COALINDIA, COCHINSHIP, COFORGE, CONCOR, CROMPTON, DCBBANK, DELHIVERY, DHANBANK, DLF, DRREDDY, EASEMYTRIP, ETERNAL, EXIDEIND, GAIL, GATEWAY, GMRINFRA, GNFC, GODREJCP, GRAPHITE, GRSE, GSFC, HAL, HCLTECH, HFCL, HINDALCO, HUDCO, ICICIBANK, IDBI, IIFL, INDBANK, INDHOTEL, INDIANB, INDUSTOWER, INFY, IOB, IOC, IRCON, IRCTC, IRFC, JINDALSTEL, JSWENERGY, KARURVYSYA, LICHSGFIN, LICI, LODHA, LT, M&M, MANAPPURAM, MANINFRA, MAXHEALTH, MAZDOCK, MIDHANI, MOTHERSON, NATIONALUM, NAZARA, NBCC, NETWORK18, NFL, NHPC, NIACL, NMDC, NTPC, ONGC, PARADEEP, PETRONET, PFC, PHOENIXLTD, PNB, POLICYBZR, POWERGRID, PRESTIGE, PSB, PTC, RAILTEL, RAIN, RAYMOND, RCF, RECLTD, RELIANCE, RPOWER, RVNL, SAIL, SBIN, SHRIRAMFIN, SJVN, SOBHA, SONACOMS, SOUTHBANK, SPARC, SUNPHARMA, SURYODAY, SWANENERGY, SYNGENE, TATACOMM, TATAMOTORS, TATAPOWER, TATASTEEL, TCS, TECHM, TEXRAIL, TITAGARH, TVSMOTOR, UNIONBANK, VBL, VOLTAS, WELCORP, WIPRO, YESBANK, ZYDUSLIFE",138
2024-02-29,"ABCAPITAL, ADANIENT, ADANIGREEN, ADANIPORTS, ADANIPOWER, AEGISLOG, AMBUJACEM, ANANTRAJ, APOLLO, APOLLOTYRE, BALAJITELE, BANKBARODA, BDL, BEL, BERGEPAINT, BHARTIARTL, BHEL, BIOCON, BPCL, BSE, CANBK, CASTROLIND, CENTRALBK, CIPLA, COALINDIA, COCHINSHIP, COFORGE, CONCOR, DELHIVERY, DHANBANK, DLF, DRREDDY, EASEMYTRIP, EIDPARRY, ETERNAL, GAIL, GLENMARK, GMRINFRA, GRAPHITE, GRASIM, HAL, HAVELLS, HCLTECH, HFCL, HUDCO, ICICIBANK, IDBI, INDHOTEL, INDIANB, INDUSTOWER, INFY, IOB, IOC, IRCON, IRFC, JINDALSTEL, JSWENERGY, KARURVYSYA, LAURUSLABS, LICHSGFIN, LICI, LODHA, LT, LUPIN, M&M, MAXHEALTH, MFSL, MOTHERSON, NATCOPHARM, NATIONALUM, NBCC, NESTLEIND, NHPC, NIACL, NMDC, NTPC, ONGC, PETRONET, PHOENIXLTD, PIDILITIND, PNB, POLICYBZR, POWERGRID, PSB, RAILTEL, RAIN, RAYMOND, RELIANCE, RVNL, SBILIFE, SBIN, SHRIRAMFIN, SJVN, SONACOMS, SOUTHBANK, SUNPHARMA, SURYODAY, SWANENERGY, TATAMOTORS, TATAPOWER, TATASTEEL, TCS, TEXRAIL, TORNTPOWER, TRENT, UNIONBANK, VBL, VGUARD, VOLTAS, WIPRO, ZYDUSLIFE",111
2024-03-28,"ADANIENT, ADANIPORTS, AEGISLOG, AMBUJACEM, AUROPHARMA, BAJAJFINSV, BANKBARODA, BDL, BEL, BHARTIARTL, BHEL, BPCL, BSE, CANBK, CGPOWER, CHOLAFIN, CIPLA, COALINDIA, COCHINSHIP, DLF, ETERNAL, FEDERALBNK, GAIL, GLENMARK, GRAPHITE, HAL, HDFCLIFE, HINDALCO, HUDCO, ICICIBANK, ICICIPRULI, INDHOTEL, INDIANB, INDIGO, INDUSINDBK, INDUSTOWER, INTELLECT, IOC, JINDALSTEL, JSWENERGY, JSWSTEEL, KARURVYSYA, LODHA, LT, LTFOODS, M&M, MANKIND, MAXHEALTH, MFSL, MOTHERSON, MUTHOOTFIN, NATIONALUM, NESTLEIND, NHPC, NTPC, NYKAA, ONGC, PHOENIXLTD, PIDILITIND, PNB, POLICYBZR, POWERGRID, PRAJIND, RELIANCE, RPOWER, SAIL, SAPPHIRE, SBILIFE, SBIN, SONACOMS, SUNPHARMA, SWANENERGY, TATACHEM, TATAMOTORS, TATAPOWER, TATASTEEL, TORNTPOWER, TVSMOTOR, UNIONBANK, VBL, VOLTAS, ZYDUSLIFE",82
2024-04-30,"ABCAPITAL, ABFRL, ADANIENSOL, ADANIPORTS, ADANIPOWER, ADANITRANS, AEGISLOG, AMBUJACEM, ANANTRAJ, APOLLOTYRE, ASHOKLEY, AUROPHARMA, AXISBANK, BAJAJFINSV, BANKBARODA, BDL, BEL, BHARTIARTL, BHEL, BIOCON, BSE, CANBK, CASTROLIND, CENTRALBK, CESC, CGPOWER, CHAMBLFERT, CHOLAFIN, COALINDIA, COCHINSHIP, CONCOR, CROMPTON, DCBBANK, DLF, EASEMYTRIP, ETERNAL, EXIDEIND, FEDERALBNK, GAIL, GATEWAY, GMRINFRA, GNFC, GRAPHITE, GRSE, GSFC, HAL, HAVELLS, HFCL, HINDALCO, HINDZINC, HUDCO, ICICIBANK, IDBI, INDIANB, INDIGO, INDUSINDBK, INDUSTOWER, IOB, IRCON, IRCTC, IRFC, JINDALSTEL, JSWENERGY, JSWSTEEL, JUSTDIAL, KARURVYSYA, KEC, LAURUSLABS, LICHSGFIN, LT, LTFOODS, LUPIN, M&M, MANAPPURAM, MAXHEALTH, MAZDOCK, MFSL, MIDHANI, MOTHERSON, NATIONALUM, NBCC, NFL, NHPC, NIACL, NMDC, NTPC, NYKAA, ONGC, PETRONET, PFC, PNB, PNBHOUSING, POLICYBZR, POWERGRID, PSB, PTC, RAILTEL, RAYMOND, RBLBANK, RCF, RECLTD, RPOWER, RVNL, SAIL, SBIN, SHRIRAMFIN, SJVN, SOUTHBANK, SURYODAY, TATAMOTORS, TATAPOWER, TATASTEEL, TEXRAIL, TORNTPOWER, TRENT, UJJIVANSFB, UNIONBANK, VBL, VEDL, VOLTAS, YESBANK",121
2024-05-31,"ABCAPITAL, ABFRL, ADANIENSOL, ADANIENT, ADANIGREEN, ADANIPORTS, ADANIPOWER, ADANITRANS, AEGISLOG, AMBUJACEM, ANANTRAJ, ASHOKLEY, AUROPHARMA, AXISBANK, BANKBARODA, BDL, BEL, BHARTIARTL, BHEL, BIOCON, BPCL, CANBK, CENTRALBK, CESC, CGPOWER, CHAMBLFERT, CHOLAFIN, CIPLA, COALINDIA, COCHINSHIP, CONCOR, CROMPTON, DCBBANK, EXIDEIND, FEDERALBNK, FINCABLES, GAIL, GLENMARK, GMRINFRA, GODREJCP, GODREJPROP, GRSE, HAL, HAVELLS, HFCL, HINDALCO, HINDZINC, HUDCO, ICICIBANK, IDBI, INDIANB, INDIGO, INDUSTOWER, IOB, IRCON, IRCTC, IRFC, JINDALSTEL, JSWENERGY, JSWSTEEL, KARURVYSYA, LICI, LODHA, LT, M&M, MARICO, MAZDOCK, MIDHANI, MOTHERSON, NATIONALUM, NBCC, NFL, NHPC, NMDC, NTPC, OBEROIRLTY, PETRONET, PFC, PHOENIXLTD, PIDILITIND, PNB, POLICYBZR, POWERGRID, PRESTIGE, PSB, RAILTEL, RCF, RECLTD, RVNL, SAIL, SBIN, SIEMENS, SJVN, SONACOMS, TATAPOWER, TATASTEEL, TEXRAIL, TITAGARH, TORNTPOWER, TVSMOTOR, UNIONBANK, VEDL, VGUARD, VOLTAS, ZYDUSLIFE",105
2024-06-28,"ABCAPITAL, ABFRL, ADANIENT, ADANIPORTS, ADANIPOWER, AEGISLOG, AMBUJACEM, ANANTRAJ, APOLLOTYRE, ASHOKLEY, AUROPHARMA, AXISBANK, BANKBARODA, BDL, BEL, BEML, BHARTIARTL, BHEL, BIOCON, BSOFT, CANBK, CANFINHOME, CASTROLIND, CESC, CGPOWER, CHAMBLFERT, CHOLAFIN, CIPLA, COALINDIA, COCHINSHIP, CROMPTON, CUMMINSIND, DABUR, DCBBANK, DRREDDY, EIDPARRY, ETERNAL, EXIDEIND, FEDERALBNK, GABRIEL, GAIL, GMRINFRA, GNFC, GODREJCP, GRASIM, GRSE, GSFC, HAL, HAVELLS, HCLTECH, HDFCBANK, HFCL, HINDALCO, HINDZINC, HUDCO, ICICIBANK, ICICIGI, ICICIPRULI, INDHOTEL, INDIANB, INDIGO, INDUSTOWER, INFY, IRCON, IRFC, JINDALSTEL, JSWENERGY, JSWSTEEL, JUBLFOOD, KARURVYSYA, KEC, KOTAKBANK, LICHSGFIN, LODHA, LT, LTFOODS, LUPIN, M&M, MANAPPURAM, MARICO, MAXHEALTH, MAZDOCK, MIDHANI, MINDACORP, MOTHERSON, NATCOPHARM, NATIONALUM, NBCC, NESTLEIND, NFL, NHPC, NIACL, NTPC, NYKAA, ONGC, PARADEEP, PETRONET, PFC, PHOENIXLTD, PNBHOUSING, POLICYBZR, POWERGRID, PRAJIND, PRESTIGE, RAILTEL, RAYMOND, RBLBANK, RCF, RECLTD, RELIANCE, RPOWER, RVNL, SBILIFE, SBIN, SHRIRAMFIN, SIEMENS, SONACOMS, SUNPHARMA, TATACHEM, TATAMOTORS, TATAPOWER, TATASTEEL, TCS, TECHM, TEXRAIL, TITAGARH, TORNTPOWER, TVSMOTOR, VBL, VEDL, VOLTAS, WIPRO, ZYDUSLIFE",133
2024-07-31,"ABFRL, ADANIENSOL, ADANIGREEN, ADANIPORTS, ADANIPOWER, ADANITRANS, AMBUJACEM, ANANTRAJ, APOLLO, APOLLOTYRE, ASHOKLEY, AUROPHARMA, BAJAJFINSV, BEL, BEML, BHARTIARTL, BHEL, BIOCON, BPCL, BSE, CASTROLIND, CESC, CGPOWER, CHAMBLFERT, CHOLAFIN, CIPLA, COALINDIA, COCHINSHIP, COFORGE, CROMPTON, DABUR, DHANBANK, DLF, DRREDDY, ETERNAL, FEDERALBNK, GAIL, GATEWAY, GMRINFRA, GNFC, GODREJCP, GRSE, GSFC, HCLTECH, HDFCBANK, HDFCLIFE, HFCL, HINDUNILVR, HUDCO, ICICIBANK, ICICIPRULI, IDBI, INDHOTEL, INDIANB, INDUSTOWER, INFY, IOB, IOC, IRCON, IRFC, ITC, JSWENERGY, JSWSTEEL, JUBLFOOD, JUSTDIAL, KARURVYSYA, KEC, KOTAKBANK, LAURUSLABS, LICHSGFIN, LICI, LT, LTFOODS, LUPIN, M&M, MANAPPURAM, MANINFRA, MARICO, MAXHEALTH, MAZDOCK, MIDHANI, MOTHERSON, MPHASIS, NATCOPHARM, NATIONALUM, NAZARA, NBCC, NETWORK18, NFL, NHPC, NIACL, NTPC, NYKAA, OBEROIRLTY, ONGC, PARADEEP, PETRONET, PFC, PNB, PNBHOUSING, POWERGRID, PRESTIGE, PSB, PTC, RAILTEL, RAIN, RAYMOND, RCF, RECLTD, RELIANCE, RPOWER, RVNL, SAIL, SBILIFE, SBIN, SHRIRAMFIN, SJVN, SONACOMS, SONATSOFTW, SUNPHARMA, SWANENERGY, SYNGENE, TATACHEM, TATAMOTORS, TATAPOWER, TCS, TECHM, TEXRAIL, TITAGARH, TORNTPOWER, VBL, VOLTAS, WELCORP, WIPRO, YESBANK, ZYDUSLIFE",136
2024-08-30,"ADANIGREEN, ANANTRAJ, ASHOKLEY, ASIANPAINT, AUROPHARMA, BAJAJFINSV, BHARTIARTL, BIOCON, BPCL, BSE, CASTROLIND, CESC, CHAMBLFERT, CHOLAFIN, CIPLA, COALINDIA, COFORGE, CROMPTON, DABUR, DELHIVERY, DLF, DRREDDY, ETERNAL, FEDERALBNK, GAIL, GLENMARK, GODREJCP, GRASIM, HCLTECH, HDFCLIFE, HFCL, HINDALCO, HINDUNILVR, ICICIBANK, ICICIPRULI, IDBI, INDHOTEL, INDIANB, INDIGO, INDUSTOWER, INFY, IOC, ITC, JSWENERGY, JSWSTEEL, JUBLFOOD, KARURVYSYA, KEC, LAURUSLABS, LT, LTFOODS, LUPIN, M&M, MANAPPURAM, MFSL, MINDACORP, MOTHERSON, NATCOPHARM, NAZARA, NBCC, NETWORK18, NIACL, NTPC, NYKAA, ONGC, PETRONET, PFC, PNBHOUSING, POLICYBZR, PRAJIND, PRESTIGE, RAIN, RAYMOND, RECLTD, RPOWER, RVNL, SAPPHIRE, SBILIFE, SHRIRAMFIN, SONACOMS, STARHEALTH, SUNPHARMA, TATAMOTORS, TATAPOWER, TCS, TECHM, TITAN, TRENT, TVSMOTOR, UPL, VEDL, VOLTAS, WELCORP, WIPRO",94
2024-09-30,"ABCAPITAL, ABFRL, ADANIENT, ADANIGREEN, ANANTRAJ, APOLLOTYRE, ASIANPAINT, AXISBANK, BAJAJFINSV, BAJFINANCE, BERGEPAINT, BHARTIARTL, BIOCON, BPCL, BSE, CANBK, CESC, CGPOWER, CHAMBLFERT, CHOLAFIN, CIPLA, COALINDIA, COFORGE, DELHIVERY, DEVYANI, DLF, ETERNAL, EXIDEIND, FEDERALBNK, FIVESTAR, GAIL, GLENMARK, GRAPHITE, HCLTECH, HDFCBANK, HDFCLIFE, HFCL, HIKAL, HINDALCO, HINDUNILVR, ICICIBANK, ICICIPRULI, INDHOTEL, INDIGO, INFY, IOC, ITC, JINDALSTEL, JIOFIN, JSWENERGY, JSWSTEEL, JUBLFOOD, KEC, LAURUSLABS, LT, LTFOODS, LUPIN, M&M, MARICO, MAXHEALTH, MFSL, MINDACORP, MOTHERSON, NATIONALUM, NAZARA, NBCC, NESTLEIND, NMDC, NTPC, PAYTM, PNBHOUSING, POWERGRID, PRAJIND, PRESTIGE, RAIN, RCOM, RPOWER, SAIL, SAPPHIRE, SAREGAMA, SBICARD, SBILIFE, SHRIRAMFIN, SIGNATURE, SONACOMS, STARHEALTH, SUNPHARMA, SYNGENE, TATACHEM, TATAPOWER, TATASTEEL, TITAN, TORNTPOWER, TRENT, UPL, VEDL, VOLTAS, WIPRO",98
2024-10-31,"AMBER, ANANTRAJ, BSE, COFORGE, FEDERALBNK, HDFCBANK, HINDZINC, ICICIBANK, INDIANB, KARURVYSYA, LAURUSLABS, LT, MAXHEALTH, MFSL, NATIONALUM, NITCO, OBEROIRLTY, PARADEEP, PAYTM, RPOWER, SBIN, TATACHEM, TEXRAIL, WIPRO",24
2024-11-29,"ASHOKLEY, BEL, BIOCON, BSE, CHAMBLFERT, COFORGE, ETERNAL, FEDERALBNK, HAL, HCLTECH, HDFCBANK, ICICIBANK, INDHOTEL, INDIANB, JUBLFOOD, KARURVYSYA, KEC, LAURUSLABS, LT, M&M, MAZDOCK, NATIONALUM, NAZARA, NFL, OBEROIRLTY, PARADEEP, PAYTM, PFC, POLICYBZR, PRAJIND, RAMCOCEM, RCF, RECLTD, SBIN, TCS, TECHM, TEXRAIL, UPL, VBL, WIPRO",40
2024-12-31,"AEGISLOG, ANANTRAJ, APOLLOTYRE, AUROPHARMA, BIOCON, BSE, CESC, CIPLA, COFORGE, DEVYANI, DRREDDY, ETERNAL, FIVESTAR, HCLTECH, INDHOTEL, IREDA, ITC, JUBLFOOD, KEC, KOTAKBANK, LAURUSLABS, LODHA, LUPIN, M&M, MANAPPURAM, MANINFRA, MARICO, MAXHEALTH, MAZDOCK, NAZARA, OBEROIRLTY, PARADEEP, PAYTM, PETRONET, POLICYBZR, RAYMOND, RCF, RPOWER, SUNPHARMA, SWANENERGY, VBL, VOLTAS, WIPRO",43
